ts_utc,source,crypto,title,link,sentiment,id
2026-01-16T06:34:50Z,CoinDesk,ALL,XRP falls 4% on crypto market weakness even as ETF inflows stay strong,https://www.coindesk.com/markets/2026/01/16/xrp-falls-4-on-crypto-market-weakness-even-as-etf-inflows-stay-strong,0.128,eab1d9c2823ef6c12d42dd77d30a978d
2026-01-16T06:34:50Z,CoinDesk,ALL,Dogecoin drops 4% as traders sell rallies and support gives way,https://www.coindesk.com/markets/2026/01/16/dogecoin-drops-4-as-traders-sell-rallies-and-support-gives-way,0.4019,aa7b5787bf8fc2c4302e0ab16a9fcdf4
2026-01-16T06:34:50Z,CoinDesk,BTC,"Bitcoin slips to nearly $95,000 as Senate delay and risk-off moves weigh on crypto",https://www.coindesk.com/markets/2026/01/16/bitcoin-slips-to-nearly-usd95-000-as-senate-delay-and-risk-off-moves-weigh-on-crypto,-0.3182,3b5ae4621924c7d364b5470800888121
2026-01-16T06:34:50Z,CoinDesk,BTC,"Bitcoin's next big test is breaking through $100,000: Asia Morning Briefing",https://www.coindesk.com/markets/2026/01/16/bitcoin-s-next-big-test-is-breaking-through-usd100-000-asia-morning-briefing,0.0,44439d2db417aceafea4da307e7f7969
2026-01-16T06:34:50Z,CoinDesk,ALL,"BitMine expects $400 million income on ether holdings, bet on MrBeast could '10x'",https://www.coindesk.com/business/2026/01/15/bitmine-expects-usd400-million-income-on-ether-holdings-bet-on-mrbeast-could-10x,0.0,eb848c5fdaef31ac5cd1ad04f28f5769
2026-01-16T06:34:50Z,CoinDesk,ALL,Tokenization firms reject Coinbase's crypto bill equities claims,https://www.coindesk.com/policy/2026/01/15/tokenization-firms-reject-coinbase-s-crypto-bill-equities-claims,-0.4019,334b2a9b8d90f94513affbf809d3132f
2026-01-16T06:34:50Z,CoinDesk,ALL,Coinbase CEO Brian Armstrong says company opposed crypto bill to protect consumers,https://www.coindesk.com/policy/2026/01/15/coinbase-ceo-brian-armstrong-says-company-opposed-crypto-bill-to-protect-consumers,0.3818,8f58001dee119efa10e7d89fb6070174
2026-01-16T06:34:50Z,CoinDesk,ALL,DTCC aiming to make all 1.4 million securities in its custody digitally eligible,https://www.coindesk.com/markets/2026/01/15/dtcc-says-it-aims-to-make-all-1-4-million-securities-in-its-custody-digitally-eligible,0.296,f625a27b1aaad299c2e7f150cae13ca9
2026-01-16T06:34:50Z,CoinDesk,ALL,Senate Democrats pursuing a Friday call with crypto industry on market structure bill,https://www.coindesk.com/policy/2026/01/15/senate-democrats-pursuing-a-friday-call-with-crypto-industry-on-market-structure-bill,0.0,81f7a87dde79c084bf6517e3882d6971
2026-01-16T06:34:50Z,CoinDesk,ALL,"Goldman is 'spending a lot of time' on crypto, prediction markets efforts, CEO Solomon says",https://www.coindesk.com/business/2026/01/15/goldman-sachs-sees-crypto-tokenization-and-prediction-markets-as-growth-areas,0.0,7fc358dd795c49460476a7a78fe33c34
2026-01-16T06:34:50Z,CoinDesk,ALL,"DeFi community sees ‘bad’ crypto bill’s collapse as win, not setback",https://www.coindesk.com/markets/2026/01/15/defi-sees-bad-crypto-bill-s-collapse-as-win-not-setback,0.1531,2a70cdafc9e2232c6aca43fb8461487e
2026-01-16T06:34:50Z,CoinDesk,ALL,House Democrats slam SEC for dropping crypto cases with Trump ties,https://www.coindesk.com/policy/2026/01/15/democrats-slam-sec-for-dropping-crypto-cases-amid-trump-ties,-0.3818,ebde89f332187c3b74f99cb00aebf6cb
2026-01-16T06:34:50Z,CoinDesk,ALL,"The big crypto bill isn't dead, may return next month as Wall Street fight still looms",https://www.coindesk.com/news-analysis/2026/01/15/the-big-crypto-bill-isn-t-dead-may-return-next-month-as-wall-street-fight-still-looms,0.0624,d11d5bf9438724db796f1ca4641d0efc
2026-01-16T06:34:50Z,CoinDesk,ALL,"Kaito to sunset 'Yaps' as X cracks down on InfoFi apps, token falls 17%",https://www.coindesk.com/business/2026/01/15/kaito-to-sunset-yaps-as-x-cracks-down-on-infofi-apps-token-falls-17,0.0,d64cd2e1986d674992c85cb62945433c
2026-01-16T06:34:50Z,CoinDesk,BTC,Citrea unveils U.S. Treasury-backed stablecoin for its Bitcoin ecosystem,https://www.coindesk.com/business/2026/01/15/citrea-unveils-u-s-treasury-backed-stablecoin-for-its-bitcoin-ecosystem,0.0,cb5064f4725bbb78cd2a01c4f5dc1aeb
2026-01-16T06:34:50Z,CoinDesk,ALL,"Coinbase fears tokenization rival Securitize, says Citron Research",https://www.coindesk.com/markets/2026/01/15/cantor-equity-partners-ii-stock-gains-as-citron-says-coinbase-fears-tokenization-rival,-0.3612,7315baab98a8ca900039a7814fd0ee95
2026-01-16T06:34:50Z,CoinDesk,ALL,Crypto for Advisors: Blockchain’s Impact on Government,https://www.coindesk.com/coindesk-indices/2026/01/14/crypto-for-advisors-blockchain-s-impact-on-government,0.0,86dd465b8d3ffa49b2678e7ca03fcd48
2026-01-16T06:34:50Z,CoinDesk,ALL,Galaxy Digital stock rises 4% after Texas grid operator approves data center expansion,https://www.coindesk.com/business/2026/01/15/galaxy-digital-stock-rises-4-after-texas-grid-operator-approves-data-center-expansion,0.4019,6fca9904b0f9e71364ab676cf50e2428
2026-01-16T06:34:50Z,CoinDesk,BTC,"Bitcoin slides below $96,000 as key crypto bill stalls in Congress",https://www.coindesk.com/markets/2026/01/15/bitcoin-slides-below-usd96-000-as-key-crypto-bill-stalls-in-congress,0.0,82460f8245d8bf0c420f494ded9ee8f4
2026-01-16T06:34:50Z,CoinDesk,ALL,Ripple injects $150 million into LMAX to push RLUSD stablecoin for institutions,https://www.coindesk.com/markets/2026/01/15/ripple-injects-usd150-million-into-lmax-to-push-rlusd-stablecoin-for-institutions,0.0,8f030189b5fca32ddb26e811daae80ee
2026-01-16T06:34:50Z,CoinDesk,ALL,"Michael Saylor's Strategy still has major upside despite 2025 plunge, says TD Cowen",https://www.coindesk.com/markets/2026/01/15/td-cowen-cuts-its-price-target-for-strategy-to-usd440-as-bitcoin-yield-outlook-slips,0.0,0684f8b22e1ee980886130729a62bc50
2026-01-16T06:34:50Z,CoinDesk,ALL,Bank of America CEO says stablecoins could drain trillions in bank deposits,https://www.coindesk.com/business/2026/01/15/bank-of-america-ceo-says-stablecoins-could-drain-trillions-in-bank-deposits,0.0,b42325369dcd5928dfef426bd8f0d4ed
2026-01-16T06:34:50Z,CoinDesk,ALL,"Crypto bill delay 'may ultimately be constructive' for final product, Benchmark says",https://www.coindesk.com/policy/2026/01/15/crypto-bill-delay-may-ultimately-be-constructive-for-final-product-benchmark-says,-0.3182,a692472ff2d47010ba5a9ba2e68ce720
2026-01-16T06:34:50Z,CoinDesk,ALL,JPMorgan sees 2026 crypto inflows topping the $130 billion hit in 2025,https://www.coindesk.com/markets/2026/01/15/jpmorgan-sees-2026-crypto-inflows-topping-the-usd130-billion-hit-in-2025,0.0,5a6874b1a17867cf03d8912267d141ba
2026-01-16T06:34:50Z,CoinDesk,ALL,"CoinDesk 20 Performance Update: Uniswap (UNI) Drops 4.6%, Leading Index Lower",https://www.coindesk.com/coindesk-indices/2026/01/15/coindesk-20-performance-update-uniswap-uni-drops-4-6-leading-index-lower,-0.296,5f42d93beca2b9715b6f879d666a2537
2026-01-16T06:34:50Z,Cointelegraph,ALL,Interactive Brokers to allow stablecoins for account funding,https://cointelegraph.com/news/interactive-brokers-usdc-stablecoin-fundingl-investors?utm_source=rss_feed&utm_medium=rss&utm_campaign=rss_partner_inbound,0.4215,3df95f1504a315fc3d5f7fb229530cc4
2026-01-16T06:34:50Z,Cointelegraph,ALL,US housebuilder to launch crypto rewards after SEC ‘no-action’ letter,https://cointelegraph.com/news/megatel-homes-megprime-housing-crypto-rewards-sec?utm_source=rss_feed&utm_medium=rss&utm_campaign=rss_partner_inbound,0.8519,2f9174b0f3658b5c2cd5daf82519cce6
2026-01-16T06:34:50Z,Cointelegraph,ALL,State Street rolls out new crypto tokenization tools,https://cointelegraph.com/news/state-street-rolls-out-tokenization-platform?utm_source=rss_feed&utm_medium=rss&utm_campaign=rss_partner_inbound,0.4019,324d372c6f21cd593c6344826dd0b0e4
2026-01-16T06:34:50Z,Cointelegraph,BNB,"Crypto plumbing, policy improved in 2025, but prices ‘did not cooperate’: Binance",https://cointelegraph.com/news/crypto-2025-volatility-regulation-stablecoins-institutional-adoption?utm_source=rss_feed&utm_medium=rss&utm_campaign=rss_partner_inbound,0.7351,06a2e17506a49142381a46348d859072
2026-01-16T06:34:50Z,Cointelegraph,ETH,Ethereum activity doubles with influx of new users: Glassnode,https://cointelegraph.com/news/ethereum-network-activity-doubles-with-massive-influx-of-first-time-users-glassnode?utm_source=rss_feed&utm_medium=rss&utm_campaign=rss_partner_inbound,0.0,0fae2494d3841a7748f6a43efbe20563
2026-01-16T06:34:50Z,Cointelegraph,ALL,US college athlete body urges CFTC pause college sports prediction markets,https://cointelegraph.com/news/ncaa-asks-cftc-suspend-college-sport-prediction-markets?utm_source=rss_feed&utm_medium=rss&utm_campaign=rss_partner_inbound,0.0,c499c7e4443f052c43653cd64a9308c3
2026-01-16T06:34:50Z,Cointelegraph,ALL,Crypto sentiment drops amid unease over US market structure bill,https://cointelegraph.com/news/crypto-market-sentiment-us-clarity-act-industry?utm_source=rss_feed&utm_medium=rss&utm_campaign=rss_partner_inbound,-0.9001,504e9ff06195b0e9a59caa9c834f110f
2026-01-16T06:34:50Z,Cointelegraph,ALL,DeadLock ransomware hides using exploited Polygon smart contracts,https://cointelegraph.com/news/deadlock-ransomware-hides-exploited-polygon-smart-contracts?utm_source=rss_feed&utm_medium=rss&utm_campaign=rss_partner_inbound,-0.7906,6d34be86b84f8d60cab956df6ccdf09b
2026-01-16T06:34:50Z,Cointelegraph,ALL,Nexo to pay $500K fine to California regulator over ‘risky loans’,https://cointelegraph.com/news/california-dfpi-nexo-fine-crypto-backed-loans-risky?utm_source=rss_feed&utm_medium=rss&utm_campaign=rss_partner_inbound,0.4767,ab49f856c9fb8d13981f8557159b7f08
2026-01-16T06:34:50Z,Cointelegraph,BTC,Iran’s crypto ecosystem spikes to $7.8B amid mass protests: Chainalysis,https://cointelegraph.com/news/bitcoin-use-surges-iran-protests-crypto-withdrawals?utm_source=rss_feed&utm_medium=rss&utm_campaign=rss_partner_inbound,-0.6597,cb14d52620b952622b573592aaf0bba0
2026-01-16T06:34:50Z,Cointelegraph,ALL,Kaito winds down crypto-backed ‘Yaps’ as X bans payments for ‘AI slop’,https://cointelegraph.com/news/kaito-cookie-slide-as-x-bans-payment-ai-powered-posts?utm_source=rss_feed&utm_medium=rss&utm_campaign=rss_partner_inbound,-0.1779,5ab730d40ce0cdc89598016c2631ce6f
2026-01-16T06:34:50Z,Cointelegraph,ALL,Uniswap lands on OKX’s X Layer as exchange deepens DeFi strategy,https://cointelegraph.com/news/uniswap-xlayer-okx-defi-push-evm?utm_source=rss_feed&utm_medium=rss&utm_campaign=rss_partner_inbound,0.0,d2621d152f25dba1d3bdb80c85ff9276
2026-01-16T06:34:50Z,Cointelegraph,BTC,"Bitcoin rally collapses at $97K as funding rate stalls, retail traders sit out",https://cointelegraph.com/news/bitcoin-rally-collapses-at-97k-as-funding-rate-stalls-retail-traders-sit-out?utm_source=rss_feed&utm_medium=rss&utm_campaign=rss_partner_inbound,-0.8176,8dbc548bc799d53304dfbf4c862b67a9
2026-01-16T06:34:50Z,Cointelegraph,BTC,Here’s what happened in crypto today,https://cointelegraph.com/news/what-happened-in-crypto-today?utm_source=rss_feed&utm_medium=rss&utm_campaign=rss_partner_inbound,0.0,d2821cec0056a7e10af9203ce051daba
2026-01-16T06:34:50Z,Cointelegraph,ETH,"ETH’s next stop could be $4.1K, but this must happen first",https://cointelegraph.com/news/eth-s-next-stop-could-be-dollar4-1k-but-this-must-happen-first?utm_source=rss_feed&utm_medium=rss&utm_campaign=rss_partner_inbound,-0.5267,22379af831674c67189c9868f5de9d19
2026-01-16T06:34:50Z,Cointelegraph,BTC,West Virginia lawmaker introduces bill to allow state crypto investments,https://cointelegraph.com/news/west-virginia-bill-treasury-digital-assets?utm_source=rss_feed&utm_medium=rss&utm_campaign=rss_partner_inbound,0.7351,120251b026c16aa08793adafa617135e
2026-01-16T06:34:50Z,Cointelegraph,BTC,Behind the ‘Bitcoin lottery’ myth: NiceHash clarifies untagged BTC blocks,https://cointelegraph.com/news/nicehash-untagged-bitcoin-blocks-solo-miner-myth?utm_source=rss_feed&utm_medium=rss&utm_campaign=rss_partner_inbound,-0.2263,27cb3bc39aef4f57b3f7fea282bad5fb
2026-01-16T06:34:50Z,Cointelegraph,ALL,Coinbase CEO expects market structure bill markup ‘in a few weeks‘,https://cointelegraph.com/news/coinbase-ceo-crypto-market-structure-bill-markup?utm_source=rss_feed&utm_medium=rss&utm_campaign=rss_partner_inbound,0.0,f1cda5102ed30fe4fb925a5041b0365b
2026-01-16T06:34:50Z,Cointelegraph,ALL,BofA CEO flags $6T bank deposit risk from stablecoin yield,https://cointelegraph.com/news/bank-of-america-interest-bearing-stablecoins-us-banks?utm_source=rss_feed&utm_medium=rss&utm_campaign=rss_partner_inbound,-0.2023,ad5864df1995254d485efc33c3ef3f74
2026-01-16T06:34:50Z,Cointelegraph,BTC,Bitcoin whale balances see 21% bounce after fastest sell-off since 2023 ends,https://cointelegraph.com/news/bitcoin-whale-balances-see-21percent-bounce-after-fastest-sell-off-since-2023-ends?utm_source=rss_feed&utm_medium=rss&utm_campaign=rss_partner_inbound,0.6249,92f5209a665b3a53a0d409e6d14db106
2026-01-16T06:34:50Z,Cointelegraph,ALL,US lawmakers press SEC over paused Justin Sun enforcement case,https://cointelegraph.com/news/us-lawmakers-sec-justin-sun-case?utm_source=rss_feed&utm_medium=rss&utm_campaign=rss_partner_inbound,-0.2732,dc2fe93e1cb6164fab16f2498a4fab24
2026-01-16T06:34:50Z,Cointelegraph,BTC,"CME Group to expand crypto futures with Cardano, Chainlink and Stellar contracts",https://cointelegraph.com/news/cme-group-plans-launch-of-cardano-chainlink-and-stellar-futures?utm_source=rss_feed&utm_medium=rss&utm_campaign=rss_partner_inbound,0.7096,117f3984ee016a2db01984e7eea9e1cf
2026-01-16T06:34:50Z,Cointelegraph,BTC,Bitcoin’s renewed push to $100K sparked by fresh institutional demand,https://cointelegraph.com/news/bitcoin-renewed-push-100k-fresh-institutional-demand?utm_source=rss_feed&utm_medium=rss&utm_campaign=rss_partner_inbound,0.6124,c2b39011bd23e808bee34a70bc9ac342
2026-01-16T06:34:50Z,Cointelegraph,BTC,"Bitcoin must hold $94K next, says trader as BTC price dips at US open",https://cointelegraph.com/news/bitcoin-must-hold-94k-trader-btc-price-dips-us-open?utm_source=rss_feed&utm_medium=rss&utm_campaign=rss_partner_inbound,-0.4019,980ffd54e3110892cb1ca3e69242c50b
2026-01-16T06:34:50Z,Cointelegraph,ALL,These three XRP charts suggest a potential rally scenario toward $2.80,https://cointelegraph.com/news/these-three-xrp-charts-hint-at-a-price-rally-toward-2-80?utm_source=rss_feed&utm_medium=rss&utm_campaign=rss_partner_inbound,0.2023,36e05dcd4da0c0c27561ea88852dfe87
2026-01-16T06:34:50Z,Cointelegraph,ALL,UK mulls under‑16 social media ban amid rising online ID push,https://cointelegraph.com/news/uk-mulls-under-16-social-media-ban-amid-rising-online-id-push?utm_source=rss_feed&utm_medium=rss&utm_campaign=rss_partner_inbound,-0.8402,8085b7594b715a476ce9e6cdf362defa
2026-01-16T06:34:50Z,Cointelegraph,BTC,Five Bitcoin narratives analysts are watching beyond price,https://cointelegraph.com/news/five-bitcoin-narratives-analysts-are-watching-beyond-price?utm_source=rss_feed&utm_medium=rss&utm_campaign=rss_partner_inbound,0.5719,17c067c2c525c1e4bb54f359d7c72f44
2026-01-16T06:34:50Z,Cointelegraph,ALL,US crypto market structure bill in limbo as industry pulls support,https://cointelegraph.com/news/us-crypto-market-structure-bill-limbo-industry-support?utm_source=rss_feed&utm_medium=rss&utm_campaign=rss_partner_inbound,0.5574,43d6d6b4e477e365e7cad07fb66ef208
2026-01-16T06:34:50Z,Cointelegraph,ALL,SWIFT trials euro stablecoin in tokenized bond payments with SG-Forge,https://cointelegraph.com/news/sg-forge-swift-tokenized-bonds-eur-coinvertible-stablecoin?utm_source=rss_feed&utm_medium=rss&utm_campaign=rss_partner_inbound,0.6166,839b03f6793e7ed2b1b84148ca8cf648
2026-01-16T06:34:50Z,Cointelegraph,ALL,Galaxy closes first $75M blockchain-based loan deal on Avalanche,https://cointelegraph.com/news/galaxy-digital-closes-75m-tokenized-clo-on-avalanche?utm_source=rss_feed&utm_medium=rss&utm_campaign=rss_partner_inbound,0.3818,014b7cf39aa20f5ef73dcf2ce897a3b6
2026-01-16T06:34:50Z,CryptoSlate,BTC,Why Wall Street refuses to sell Bitcoin – and actually bought way more – even while losing 25% of its value,https://cryptoslate.com/why-wall-street-refuses-to-sell-bitcoin-and-actually-bought-way-more-even-while-losing-25-of-its-value/,0.7872,565c4b8caa2f53131522600a8c1187e2
2026-01-16T06:34:50Z,CryptoSlate,ALL,SEC Chair predicts 2-year timeline to put US fully on chain but the real $12.6 trillion opportunity isn’t equities,https://cryptoslate.com/sec-chair-predicts-2-year-timeline-to-full-tokenization-but-the-real-12-6-trillion-opportunity-isnt-equities/,0.8126,850eec012ab8fbb660deb54c6c4f33da
2026-01-16T06:34:50Z,CryptoSlate,BTC,"Bitcoin demand is breaking out, but dealers are mechanically forcing stability: Here is the exact price the dam cracks",https://cryptoslate.com/bitcoin-demand-is-breaking-out-but-dealers-are-mechanically-forcing-stability-here-is-the-exact-price-the-dam-fails/,-0.4118,3c4e8f98214afde1c1456af885107a45
2026-01-16T06:34:50Z,CryptoSlate,BTC,Get access to Strategy’s 11% Bitcoin dividends without owning the stock through this new token,https://cryptoslate.com/earning-11-yield-from-strategys-bitcoin-credit-machine-routed-to-new-stablecoin-usdat-rewards/,0.3818,d42c03f423ed81b4c72432e237a0f88f
2026-01-16T06:34:50Z,CryptoSlate,ALL,Ripple’s massive license victory hides a structural shift that could actually divert volume away from XRP,https://cryptoslate.com/ripples-massive-license-victory-hides-a-structural-shift-that-could-actually-divert-volume-away-from-xrp/,0.2732,719693917102452ceef2b40bc3e29a0a
2026-01-16T06:34:50Z,CryptoSlate,ETH,Ethereum’s surprising usage drop suggests the network solved the wrong problem with Fusaka upgrade,https://cryptoslate.com/ethereum-fusakas-new-21-blob-ceiling-looks-tempting-but-blocks-above-16-show-a-worrying-miss-rate-jump/,-0.8834,ca5f5deeeedd2fcb0f383333c637c6da
2026-01-16T06:34:50Z,CryptoSlate,BTC,"Bitcoin price is exploding, and a rare “gamma squeeze” suggests the price action is about to get violent",https://cryptoslate.com/bitcoin-price-is-exploding-and-a-rare-gamma-squeeze-suggests-the-price-action-is-about-to-get-violent/,0.4019,180eaf4fad38f062cdba2454875c193c
2026-01-16T06:34:50Z,CryptoSlate,ALL,Solana’s public attack on Starknet exposes how billions in “mercenary” volume are artificially pumping network valuations right now,https://cryptoslate.com/solanas-public-attack-on-starknet-exposes-how-billions-in-mercenary-volume-are-artificially-pumping-network-valuations-right-now/,-0.8834,b43ce53ab48d72dee80ca437abce3eda
2026-01-16T06:34:50Z,CryptoSlate,ETH,Ethereum faces a dangerous 40-day deadlock after BitMine’s aggressive staking forces a historic liquidity squeeze,https://cryptoslate.com/ethereum-faces-a-dangerous-40-day-deadlock-after-bitmines-aggressive-staking-forced-a-historic-liquidity-squeeze/,-0.8402,3bc6cc9d72fa2ed0051c7eddd103acd1
2026-01-16T06:34:50Z,CryptoSlate,BTC,"Bitcoin just wiped out $600 million in bets, triggering a “mechanical” loop that forces prices toward $100k",https://cryptoslate.com/bitcoin-just-wiped-out-600-million-in-bets-triggering-a-mechanical-loop-that-forces-prices-toward-100k/,0.2263,902ecc8d28f832ab10b8c9abd26766b6
