ts_utc,source,crypto,title,link,sentiment,id
2026-01-10T14:19:18Z,CoinDesk,ALL,Hundreds of wealthy investors are using crypto to buy real estate in Europe,https://www.coindesk.com/business/2026/01/09/hundreds-of-wealthy-investors-are-using-crypto-to-buy-real-estate-in-europe,0.3612,96e92d3dbfde74f1670d4fa3843bf050
2026-01-10T14:19:18Z,CoinDesk,BTC,Asset manager VanEck explains how one bitcoin could be worth $2.9 million by 2050,https://www.coindesk.com/markets/2026/01/09/asset-manager-vaneck-explains-how-one-bitcoin-could-be-worth-usd2-9-million-by-2050,0.5267,1f631787bbf476125faeeaad33b4ac45
2026-01-10T14:19:18Z,CoinDesk,ALL,Senate Republicans race toward crypto vote on bill with uncertain Democratic buy-in,https://www.coindesk.com/policy/2026/01/09/senate-republicans-race-toward-crypto-vote-on-draft-bill-with-uncertain-democratic-buy-in,-0.296,4f5eb0beac45c7c4340dc47cd48b5b6d
2026-01-10T14:19:18Z,CoinDesk,BTC,"Bitcoin pulls back to $90,000 as early Friday rally attempt fails",https://www.coindesk.com/markets/2026/01/09/bitcoin-pulls-back-to-usd90-000-as-early-friday-rally-attempt-fails,-0.4215,f512e75b2101fb69f5c125f59744e7d5
2026-01-10T14:19:18Z,CoinDesk,ALL,Crypto crowd could still walk away from U.S. market structure bill if DeFi needs unmet,https://www.coindesk.com/policy/2026/01/09/crypto-crowd-could-still-walk-away-from-u-s-market-structure-bill-if-defi-needs-unmet,0.0,c86fc506e8001d68ae5eed71f21d687c
2026-01-10T14:19:18Z,CoinDesk,ALL,World's largest custodial bank BNY to offer tokenized deposits for institutional investors,https://www.coindesk.com/business/2026/01/09/world-s-largest-custodial-bank-bny-to-offer-tokenized-deposits-for-institutional-investors,0.0,a7b2d431ffa9e71388f4cb04c05dd982
2026-01-10T14:19:18Z,CoinDesk,ALL,Crypto exchange OKX cuts institutional staff amid global restructuring,https://www.coindesk.com/business/2026/01/09/crypto-exchange-okx-cuts-institutional-staff-amid-global-restructuring,-0.296,caa076ae944c616833fdb788665d224d
2026-01-10T14:19:18Z,CoinDesk,ALL,Tether said to have invested up to $50 million in crypto lender Ledn at $500 million valuation,https://www.coindesk.com/business/2026/01/09/tether-said-to-have-invested-up-to-usd50-million-in-crypto-lender-ledn-at-usd500-million-valuation,0.0,6d281ed5a68b4eb394a054a713d8f63d
2026-01-10T14:19:18Z,CoinDesk,ALL,"Registered crypto companies must reapply for approval, UK regulator says",https://www.coindesk.com/policy/2026/01/09/registered-crypto-companies-must-reapply-for-approval-uk-regulator-says,0.4767,50bd307abb96b3b0aa77e574fbdd00dc
2026-01-10T14:19:18Z,CoinDesk,ALL,CoinDesk 20 Performance Update: Index Trades Flat as Polygon Gains 11.2%,https://www.coindesk.com/coindesk-indices/2026/01/09/coindesk-20-performance-update-index-trades-flat-as-polygon-gains-11-2,0.34,4558b920191d7a01df4bf9a78e6f5a07
2026-01-10T14:19:18Z,CoinDesk,ALL,"U.S. added 50,000 jobs in December as unemployment rate fell to 4.4%",https://www.coindesk.com/markets/2026/01/09/u-s-added-50-000-jobs-in-december-as-unemployment-rate-fell-to-4-4,-0.4404,53b6e165ec2086fa4d5adf64ea153498
2026-01-10T14:19:18Z,CoinDesk,BTC,"Bitcoin may be gearing up for a rally that sent price to $126,000 last year",https://www.coindesk.com/markets/2026/01/09/bitcoin-s-time-based-capitulation-nears-50-days-echoing-conditions-prior-to-2025-surge,0.0,23fc07354e27532986fb101cab56fe42
2026-01-10T14:19:18Z,CoinDesk,ALL,"Toncoin drops, falls through key support levels in technical breakdown",https://www.coindesk.com/markets/2026/01/09/toncoin-drops-falls-through-key-support-levels-in-technical-breakdown,0.4019,144c2cc5c4a61850ed0ed718fbdb08f4
2026-01-10T14:19:18Z,CoinDesk,ALL,Ripple wins UK regulatory approval from Financial Conduct Authority,https://www.coindesk.com/policy/2026/01/09/ripple-wins-uk-regulatory-approval-from-financial-conduct-authority,0.7964,3d4a2a2b6692c243873901c2bcbe071d
2026-01-10T14:19:18Z,CoinDesk,ALL,"U.S. jobs data, tariffs ruling suggest volatile Friday: Crypto Daybook Americas",https://www.coindesk.com/daybook-us/2026/01/09/u-s-jobs-data-tariffs-ruling-suggest-volatile-friday-crypto-daybook-americas,0.0,54a5e7ca60cda32aef319c29d2f22121
2026-01-10T14:19:18Z,CoinDesk,BTC,"Bitcoin holds near $90,000 as trading volumes shrink, altcoins diverge: Crypto Markets Today",https://www.coindesk.com/markets/2026/01/09/bitcoin-holds-near-usd90-000-as-trading-volumes-shrink-altcoins-diverge-crypto-markets-today,0.0,11dae0bc1c32b93e40ebd55b6def6a70
2026-01-10T14:19:18Z,CoinDesk,BTC,South Korea to flip bitcoin ETF stance as part of broader crypto push,https://www.coindesk.com/policy/2026/01/09/south-korea-to-flip-bitcoin-etf-stance-as-part-of-broader-crypto-push,0.0,5069c1b78ecda764ea76a62bb5504254
2026-01-10T14:19:18Z,CoinDesk,ALL,A ruble stablecoin outpaced market leaders last year despite international sanctions,https://www.coindesk.com/markets/2026/01/09/a-ruble-stablecoin-outpaced-market-leaders-last-year-despite-international-sanctions,0.0,e890a79fb63ebd9a565b16e83b96787d
2026-01-10T14:19:18Z,CoinDesk,ETH,Ethereum treasury firm SharpLink stakes $170M ETH on Linea network,https://www.coindesk.com/markets/2026/01/09/ethereum-treasury-firm-sharplink-stakes-usd170m-eth-on-linea-network,0.2023,23ff12e23254b284b630f110c2dc02ca
2026-01-10T14:19:18Z,CoinDesk,BTC,Bitcoin ETF optimism fades as three-day outflows streak erases early-month gains,https://www.coindesk.com/markets/2026/01/09/bitcoin-etf-optimism-fades-as-three-day-outflows-streak-erases-early-month-gains,0.7096,a28655128fbc4ea95f49503f1ad1fe58
2026-01-10T14:19:18Z,CoinDesk,ALL,Builders behind popular Zcash wallet Zashi to launch new startup 'cashZ',https://www.coindesk.com/markets/2026/01/09/builders-behind-popular-zcash-wallet-zashi-to-launch-new-startup-cashz,0.4215,cf2c4a263905ad97edc201954a9b781d
2026-01-10T14:19:18Z,CoinDesk,ALL,Truebit token crashes 99.9% after hacker drains $26.6 million in ether,https://www.coindesk.com/markets/2026/01/09/truebit-token-tru-crashes-99-9-after-usd26-6m-exploit-drains-8-535-eth,0.0,5b3a2608a92c0b61e6237981a1389cb9
2026-01-10T14:19:18Z,CoinDesk,ALL,XRP slips to $2.12 after liquidations clear both sides of the futures book,https://www.coindesk.com/markets/2026/01/09/xrp-slips-to-usd2-12-after-liquidations-clear-both-sides-of-the-futures-book,0.3818,b49f26e690aaf792a31791e5b166c790
2026-01-10T14:19:18Z,CoinDesk,BTC,"Bitcoin holds near $91,000 as market awaits Trump tariff ruling: Asia Morning Briefing",https://www.coindesk.com/markets/2026/01/09/bitcoin-holds-near-usd91-000-as-market-awaits-trump-tariff-ruling-asia-morning-briefing,0.0772,2cb82aaec36c5a38e6f2f77a8b4c25e8
2026-01-10T14:19:18Z,CoinDesk,ALL,Trump says he won't rescue Sam Bankman-Fried with pardon,https://www.coindesk.com/policy/2026/01/08/trump-says-he-won-t-rescue-sam-bankman-fried-with-pardon,-0.1032,dfcf43426f27a6bb5a17fb5c3671ea59
2026-01-10T14:19:18Z,Cointelegraph,BTC,Here’s what happened in crypto today,https://cointelegraph.com/news/what-happened-in-crypto-today?utm_source=rss_feed&utm_medium=rss&utm_campaign=rss_partner_inbound,0.0,d2821cec0056a7e10af9203ce051daba
2026-01-10T14:19:18Z,Cointelegraph,BTC,Betterment urges users to ignore ‘unauthorized’ crypto promotion message,https://cointelegraph.com/news/betterment-fake-crypto-promotion-triple-returns-warning?utm_source=rss_feed&utm_medium=rss&utm_campaign=rss_partner_inbound,-0.6124,c5c0d0527e7d7e96545a4c718a32e675
2026-01-10T14:19:18Z,Cointelegraph,BTC,Spot Bitcoin ETFs lose $681M in first week of 2026 as risk appetite fades,https://cointelegraph.com/news/spot-bitcoin-etfs-lose-681m-first-week-2026-risk-off?utm_source=rss_feed&utm_medium=rss&utm_campaign=rss_partner_inbound,-0.7184,49608a0cf55507744326507500fc0c20
2026-01-10T14:19:18Z,Cointelegraph,ALL,"Pump.fun says creator fees ‘may have skewed’ incentives, plans revamp",https://cointelegraph.com/news/pumpfun-revamps-creator-fees-fee-sharing-cto-controls?utm_source=rss_feed&utm_medium=rss&utm_campaign=rss_partner_inbound,0.7506,fca70a0c0257f6998e873bde685d3a41
2026-01-10T14:19:18Z,Cointelegraph,ALL,Anti-DeFi group runs ads urging public to pressure Senators on crypto bill: Report,https://cointelegraph.com/news/anti-defi-group-runs-ads-to-strip-defi-from-crypto-bill?utm_source=rss_feed&utm_medium=rss&utm_campaign=rss_partner_inbound,0.0085,01089ca8ebae0092c0e0c01a111254e5
2026-01-10T14:19:18Z,Cointelegraph,ALL,"A16z raises $15B, says crypto a 'key' to America winning next 100 years",https://cointelegraph.com/news/a16z-raises-15-billion-says-crypto-crucial-to-americas-future?utm_source=rss_feed&utm_medium=rss&utm_campaign=rss_partner_inbound,0.7783,be0050617672a31effa47bdf492ce0f2
2026-01-10T14:19:18Z,Cointelegraph,ALL,Stablecoin card adoption will be a 'big theme' of 2026: Dragonfly exec,https://cointelegraph.com/news/stablecoin-card-adoption-to-take-off-in-2026-dragonfly?utm_source=rss_feed&utm_medium=rss&utm_campaign=rss_partner_inbound,0.4019,4301f14372e792eec9cba2ba48d55b75
2026-01-10T14:19:18Z,Cointelegraph,BTC,Bitcoin tests key support as bulls reset to prepare for futures-led rally to $101.5K,https://cointelegraph.com/news/bitcoin-tests-key-support-as-bulls-reset-to-prepare-for-futures-led-rally-to-dollar101-5k?utm_source=rss_feed&utm_medium=rss&utm_campaign=rss_partner_inbound,0.7184,af12746da5202ae7f5f0f8c13cd8d161
2026-01-10T14:19:18Z,Cointelegraph,ALL,"Nasdaq, CME Group join forces to launch Nasdaq-CME Crypto Index",https://cointelegraph.com/news/nasdaq-cme-group-nasdaq-cme-crypto-index?utm_source=rss_feed&utm_medium=rss&utm_campaign=rss_partner_inbound,0.7579,34808fab322d03c4fbff2b15f527d855
2026-01-10T14:19:18Z,Cointelegraph,ALL,Colombia advances crypto tax rules as global reporting standards take shape,https://cointelegraph.com/news/colombia-advances-crypto-tax-rules-global-reporting-standards-take-shape?utm_source=rss_feed&utm_medium=rss&utm_campaign=rss_partner_inbound,0.3612,0442ce651d20c9732fd72d5979efa821
2026-01-10T14:19:18Z,Cointelegraph,ALL,US lawmakers demand ethics safeguards for market structure bill: Report,https://cointelegraph.com/news/market-structure-bill-conflict-interest-safeguards?utm_source=rss_feed&utm_medium=rss&utm_campaign=rss_partner_inbound,0.6597,ab318c1199ccd2ba7729be241f3b4ac6
2026-01-10T14:19:18Z,Cointelegraph,BTC,"Wall Street’s crypto debate is over as banks go all-in on BTC, stablecoins, tokenized cash",https://cointelegraph.com/news/wall-street-banks-crypto-etfs-tokenized-cash?utm_source=rss_feed&utm_medium=rss&utm_campaign=rss_partner_inbound,0.0,686a48126e536f0ff80212c23aab3b55
2026-01-10T14:19:18Z,Cointelegraph,ALL,"CLARITY Act hinges on bipartisan support, and here are the numbers: Analyst",https://cointelegraph.com/news/clarity-act-hinges-bipartisan-support-numbers?utm_source=rss_feed&utm_medium=rss&utm_campaign=rss_partner_inbound,0.7213,4624cffa5c07aa0957a6b4fd098ee44c
2026-01-10T14:19:18Z,Cointelegraph,ALL,US lawmaker's bill would ban politically related prediction bets after Maduro wager,https://cointelegraph.com/news/ritchie-torres-bill-elected-officials-prediction-markets-bets?utm_source=rss_feed&utm_medium=rss&utm_campaign=rss_partner_inbound,-0.802,c748c9607dbba97cdbe197d17d05b1d1
2026-01-10T14:19:18Z,Cointelegraph,ALL,Trading bots gain traction as crypto markets move sideways: HTX 2025 recap,https://cointelegraph.com/news/trading-bots-gain-traction-crypto-markets-move-sideways-htx-2025-recap?utm_source=rss_feed&utm_medium=rss&utm_campaign=rss_partner_inbound,0.8555,3531e8256994763bba4716f476ec9246
2026-01-10T14:19:18Z,Cointelegraph,BTC,Bitcoin holds $90K as ETFs wobble and institutions reposition: Finance Redefined,https://cointelegraph.com/news/bitcoin-90k-etfs-institutions-reposition?utm_source=rss_feed&utm_medium=rss&utm_campaign=rss_partner_inbound,-0.5719,20ce010568667d68850bc48f31441d4b
2026-01-10T14:19:18Z,Cointelegraph,BTC,Bitcoin’s next super rally could depend on this key data point,https://cointelegraph.com/news/bitcoin-s-next-super-rally-could-depend-on-this-key-data-point?utm_source=rss_feed&utm_medium=rss&utm_campaign=rss_partner_inbound,0.3716,9a6799c1698fe655ca1ddbdb9f750381
2026-01-10T14:19:18Z,Cointelegraph,BTC,"Price predictions 1/9: BTC, ETH, XRP, BNB, SOL, DOGE, ADA, BCH, LINK, HYPE",https://cointelegraph.com/news/price-predictions-1-9-btc-eth-xrp-bnb-sol-doge-ada-bch-link-hype?utm_source=rss_feed&utm_medium=rss&utm_campaign=rss_partner_inbound,-0.2382,30f58ade7880e407759d5a279c6c82a0
2026-01-10T14:19:18Z,Cointelegraph,ALL,BNY launches tokenized deposits amid TradFi rush into blockchain and crypto,https://cointelegraph.com/news/bny-tokenized-deposits-bank-rush-blockchain-crypto?utm_source=rss_feed&utm_medium=rss&utm_campaign=rss_partner_inbound,0.0,e73912a137d23f01e81d406f0b84d10e
2026-01-10T14:19:18Z,Cointelegraph,ETH,"Ethereum co-founder reiterates support for Roman Storm, citing privacy",https://cointelegraph.com/news/vitalik-buterin-support-roman-storm-privacy-concerns?utm_source=rss_feed&utm_medium=rss&utm_campaign=rss_partner_inbound,0.3818,48dd7aa6ccb100b2a20ab647175c4d25
2026-01-10T14:19:18Z,Cointelegraph,ALL,Security expert Bruce Schneier ‘guarantees’ governments are bulk spying with AI,https://cointelegraph.com/news/security-expert-bruce-schneier-guarantees-governments-are-bulk-spying-with-ai?utm_source=rss_feed&utm_medium=rss&utm_campaign=rss_partner_inbound,0.624,ae8f1d429d2b37ed3aa203226c169ec8
2026-01-10T14:19:18Z,Cointelegraph,BTC,Bitcoin price clings to $90K as traders eye US Supreme Court tariff ruling,https://cointelegraph.com/news/bitcoin-price-clings-90k-traders-us-supreme-court-tariff-ruling?utm_source=rss_feed&utm_medium=rss&utm_campaign=rss_partner_inbound,0.8555,354db77ecccb2a35783a2c7b0196f1fe
2026-01-10T14:19:18Z,Cointelegraph,BTC,Bitcoin RSI hints at $105K BTC price rebound as bull signals multiply,https://cointelegraph.com/news/bitcoin-rsi-bull-signals-multiply-price-battles-90k-control?utm_source=rss_feed&utm_medium=rss&utm_campaign=rss_partner_inbound,0.0,3f054beda71e90d01dfe9c9ecbf4e85c
2026-01-10T14:19:18Z,Cointelegraph,ALL,Ripple scores UK regulatory approval via local subsidiary,https://cointelegraph.com/news/ripple-uk-regulatory-approval-local-subsidiary-fca?utm_source=rss_feed&utm_medium=rss&utm_campaign=rss_partner_inbound,0.8225,6b3c54bc5633d61f9efe124f7555509b
2026-01-10T14:19:18Z,Cointelegraph,ETH,"Sharplink pockets $33M from Ether staking, deploys another $170M ETH",https://cointelegraph.com/news/sharplink-33m-ether-staking-170m-yield?utm_source=rss_feed&utm_medium=rss&utm_campaign=rss_partner_inbound,0.5267,4a405ad56e07034a7b2969ea67b0907b
2026-01-10T14:19:18Z,Cointelegraph,ALL,Visa-linked stablecoin platform Rain raises $250M at $1.95B valuation,https://cointelegraph.com/news/rain-stablecoin-platform-visa-member-250-million-raise?utm_source=rss_feed&utm_medium=rss&utm_campaign=rss_partner_inbound,0.6486,fde9ca1d69f2daf8653943ed35126cf0
2026-01-10T14:19:18Z,Cointelegraph,ALL,The hidden risk of public WiFi: How a single approval wiped a crypto wallet,https://cointelegraph.com/news/the-hidden-risk-of-public-wifi?utm_source=rss_feed&utm_medium=rss&utm_campaign=rss_partner_inbound,0.0258,abd6c69a26518902a262807230312dae
2026-01-10T14:19:18Z,Cointelegraph,BNB,Grayscale forms trusts tied to potential BNB and HYPE ETFs,https://cointelegraph.com/news/grayscale-bnb-hype-etf-delaware-trusts?utm_source=rss_feed&utm_medium=rss&utm_campaign=rss_partner_inbound,0.466,f0119338e7125f53d690d6d65fae712b
2026-01-10T14:19:18Z,Cointelegraph,ALL,Zcash sees developer slowdown as ZEC extends two-month slide,https://cointelegraph.com/news/zcash-developer-activity-2021-governance-dispute?utm_source=rss_feed&utm_medium=rss&utm_campaign=rss_partner_inbound,-0.6486,014deaf3735988d2e6a42c2528bbf8fb
2026-01-10T14:19:18Z,Cointelegraph,ALL,Vulnerability found in Babylon staking code could slow block production,https://cointelegraph.com/news/babylon-code-vulnerability-block-production?utm_source=rss_feed&utm_medium=rss&utm_campaign=rss_partner_inbound,-0.9081,ca73ee507df722c94d464d71e37a4cb7
2026-01-10T14:19:18Z,CryptoSlate,ETH,New BlackRock report exposes a historic shift in crypto that leaves only one blockchain controlling the settlement layer,https://cryptoslate.com/blackrock-stablecoin-ethereum-settlement-standard-2026/,-0.5423,e975d69e05418553d18abc32691ac53d
2026-01-10T14:19:18Z,CryptoSlate,BTC,Ethereum just solved a critical problem Bitcoin doesn’t want to fix on its own network – but why?,https://cryptoslate.com/how-cryptos-biggest-problem-the-trilemma-was-finally-solved-and-why-bitcoin-should-pay-attention/,0.4515,a3bc78dbcf2be7c0bac56ca29a1b471f
2026-01-10T14:19:18Z,CryptoSlate,BTC,Last time these whales did this Bitcoin surged to new highs but key data suggests messy weeks ahead,https://cryptoslate.com/this-viral-bitfinex-buy-signal-is-everywhere-but-the-real-bitcoin-data-suggests-a-much-messier-six-weeks/,-0.7579,bbc00330ffd7880b59d89ef2ac5acba8
2026-01-10T14:19:18Z,CryptoSlate,BTC,"Shortest bear market ever? Key metrics imply Bitcoin price could surge past $125,000 before April",https://cryptoslate.com/shortest-bear-market-ever-key-metrics-imply-bitcoin-price-could-surge-past-125000-before-april/,0.6966,ad0b8e49be7f9ad085d3c2eacdc6577e
2026-01-10T14:19:18Z,CryptoSlate,ALL,"Ripple is winning on Wall Street and in the UK, but the XRP Ledger is losing users fast and the split will define 2026",https://cryptoslate.com/xrp-is-thriving-everywhere-except-on-its-own-chain/,0.631,ddaa083d7cf2d542c9b921661c3383d7
2026-01-10T14:19:18Z,CryptoSlate,BTC,Bitcoin critical demand metric turns negative and ETFs wiped out $1.1 billion in 72 hours,https://cryptoslate.com/bitcoins-boring-sideways-era-begins-with-over-1b-etf-outflow/,-0.9337,f7a209e7ab5d898f89cb49f754fc8535
2026-01-10T14:19:18Z,CryptoSlate,BTC,"Xapo Bank’s Bitcoin Wealth Ecosystem, Explained",https://cryptoslate.com/xapo-banks-bitcoin-wealth-ecosystem-explained/,0.7506,8ae709c0e296f995e857995019f49531
2026-01-10T14:19:18Z,CryptoSlate,BTC,Today’s “perfect storm” for Bitcoin brings several critical macro tests that signal a volatility surge – what to watch,https://cryptoslate.com/bitcoin-faces-4-critical-macro-tests-today-that-should-cause-volatility-to-surge-what-to-watch/,-0.8316,592d746632a65bb6df187207b252f239
2026-01-10T14:19:18Z,CryptoSlate,ETH,One number now decides if crypto companies spending $880M+ buying back their own tokens will work,https://cryptoslate.com/token-buybacks-spent-880m-last-year-but-prices-stalled-anyway-one-number-now-decides-if-they-work/,-0.1531,be63d730f9970e3e55208f2cc6c7d37a
2026-01-10T14:19:18Z,CryptoSlate,BTC,Bitcoin is stalling because this low-key “absorption signal” shows a violent supply shock could be inevitable,https://cryptoslate.com/bitcoin-is-stalling-but-a-hidden-absorption-signal-shows-a-violent-supply-shock-could-be-inevitable/,-0.9744,7b051e12103d7776f86e1e41db9e5fb0
