ts_utc,source,crypto,title,link,sentiment,id
2026-01-15T23:21:15Z,CoinDesk,ALL,Tokenization firms reject Coinbase's crypto bill equities claims,https://www.coindesk.com/policy/2026/01/15/tokenization-firms-reject-coinbase-s-crypto-bill-equities-claims,-0.4019,334b2a9b8d90f94513affbf809d3132f
2026-01-15T23:21:15Z,CoinDesk,ALL,Coinbase CEO Brian Armstrong says company opposed crypto bill to protect consumers,https://www.coindesk.com/policy/2026/01/15/coinbase-ceo-brian-armstrong-says-company-opposed-crypto-bill-to-protect-consumers,0.3818,8f58001dee119efa10e7d89fb6070174
2026-01-15T23:21:15Z,CoinDesk,ALL,DTCC aiming to make all 1.4 million securities in its custody digitally eligible,https://www.coindesk.com/markets/2026/01/15/dtcc-says-it-aims-to-make-all-1-4-million-securities-in-its-custody-digitally-eligible,0.296,f625a27b1aaad299c2e7f150cae13ca9
2026-01-15T23:21:15Z,CoinDesk,ALL,Senate Democrats pursuing a Friday call with crypto industry on market structure bill,https://www.coindesk.com/policy/2026/01/15/senate-democrats-pursuing-a-friday-call-with-crypto-industry-on-market-structure-bill,0.0,81f7a87dde79c084bf6517e3882d6971
2026-01-15T23:21:15Z,CoinDesk,ALL,"Goldman is 'spending a lot of time' on crypto, prediction markets efforts, CEO Solomon says",https://www.coindesk.com/business/2026/01/15/goldman-sachs-sees-crypto-tokenization-and-prediction-markets-as-growth-areas,0.0,7fc358dd795c49460476a7a78fe33c34
2026-01-15T23:21:15Z,CoinDesk,ALL,"DeFi community sees ‘bad’ crypto bill’s collapse as win, not setback",https://www.coindesk.com/markets/2026/01/15/defi-sees-bad-crypto-bill-s-collapse-as-win-not-setback,0.1531,2a70cdafc9e2232c6aca43fb8461487e
2026-01-15T23:21:15Z,CoinDesk,ALL,House Democrats slam SEC for dropping crypto cases with Trump ties,https://www.coindesk.com/policy/2026/01/15/democrats-slam-sec-for-dropping-crypto-cases-amid-trump-ties,-0.3818,ebde89f332187c3b74f99cb00aebf6cb
2026-01-15T23:21:15Z,CoinDesk,ALL,"The big crypto bill isn't dead, may return next month as Wall Street fight still looms",https://www.coindesk.com/news-analysis/2026/01/15/the-big-crypto-bill-isn-t-dead-may-return-next-month-as-wall-street-fight-still-looms,0.0624,d11d5bf9438724db796f1ca4641d0efc
2026-01-15T23:21:15Z,CoinDesk,ALL,"Kaito to sunset 'Yaps' as X cracks down on InfoFi apps, token falls 17%",https://www.coindesk.com/business/2026/01/15/kaito-to-sunset-yaps-as-x-cracks-down-on-infofi-apps-token-falls-17,0.0,d64cd2e1986d674992c85cb62945433c
2026-01-15T23:21:15Z,CoinDesk,BTC,Citrea unveils U.S. Treasury-backed stablecoin for its Bitcoin ecosystem,https://www.coindesk.com/business/2026/01/15/citrea-unveils-u-s-treasury-backed-stablecoin-for-its-bitcoin-ecosystem,0.0,cb5064f4725bbb78cd2a01c4f5dc1aeb
2026-01-15T23:21:15Z,CoinDesk,ALL,"Coinbase fears tokenization rival Securitize, says Citron Research",https://www.coindesk.com/markets/2026/01/15/cantor-equity-partners-ii-stock-gains-as-citron-says-coinbase-fears-tokenization-rival,-0.3612,7315baab98a8ca900039a7814fd0ee95
2026-01-15T23:21:15Z,CoinDesk,ALL,Crypto for Advisors: Blockchain’s Impact on Government,https://www.coindesk.com/coindesk-indices/2026/01/14/crypto-for-advisors-blockchain-s-impact-on-government,0.0,86dd465b8d3ffa49b2678e7ca03fcd48
2026-01-15T23:21:15Z,CoinDesk,ALL,Galaxy Digital stock rises 4% after Texas grid operator approves data center expansion,https://www.coindesk.com/business/2026/01/15/galaxy-digital-stock-rises-4-after-texas-grid-operator-approves-data-center-expansion,0.4019,6fca9904b0f9e71364ab676cf50e2428
2026-01-15T23:21:15Z,CoinDesk,BTC,"Bitcoin slides below $96,000 as key crypto bill stalls in Congress",https://www.coindesk.com/markets/2026/01/15/bitcoin-slides-below-usd96-000-as-key-crypto-bill-stalls-in-congress,0.0,82460f8245d8bf0c420f494ded9ee8f4
2026-01-15T23:21:15Z,CoinDesk,ALL,Ripple injects $150 million into LMAX to push RLUSD stablecoin for institutions,https://www.coindesk.com/markets/2026/01/15/ripple-injects-usd150-million-into-lmax-to-push-rlusd-stablecoin-for-institutions,0.0,8f030189b5fca32ddb26e811daae80ee
2026-01-15T23:21:15Z,CoinDesk,ALL,"Michael Saylor's Strategy still has major upside despite 2025 plunge, says TD Cowen",https://www.coindesk.com/markets/2026/01/15/td-cowen-cuts-its-price-target-for-strategy-to-usd440-as-bitcoin-yield-outlook-slips,0.0,0684f8b22e1ee980886130729a62bc50
2026-01-15T23:21:15Z,CoinDesk,ALL,Bank of America CEO says stablecoins could drain trillions in bank deposits,https://www.coindesk.com/business/2026/01/15/bank-of-america-ceo-says-stablecoins-could-drain-trillions-in-bank-deposits,0.0,b42325369dcd5928dfef426bd8f0d4ed
2026-01-15T23:21:15Z,CoinDesk,ALL,"Crypto bill delay 'may ultimately be constructive' for final product, Benchmark says",https://www.coindesk.com/policy/2026/01/15/crypto-bill-delay-may-ultimately-be-constructive-for-final-product-benchmark-says,-0.3182,a692472ff2d47010ba5a9ba2e68ce720
2026-01-15T23:21:15Z,CoinDesk,ALL,JPMorgan sees 2026 crypto inflows topping the $130 billion hit in 2025,https://www.coindesk.com/markets/2026/01/15/jpmorgan-sees-2026-crypto-inflows-topping-the-usd130-billion-hit-in-2025,0.0,5a6874b1a17867cf03d8912267d141ba
2026-01-15T23:21:15Z,CoinDesk,ALL,"CoinDesk 20 Performance Update: Uniswap (UNI) Drops 4.6%, Leading Index Lower",https://www.coindesk.com/coindesk-indices/2026/01/15/coindesk-20-performance-update-uniswap-uni-drops-4-6-leading-index-lower,-0.296,5f42d93beca2b9715b6f879d666a2537
2026-01-15T23:21:15Z,CoinDesk,ALL,Stablecoins and self-custody are driving the rise of crypto neobanks,https://www.coindesk.com/tech/2026/01/15/stablecoins-and-self-custody-are-driving-the-rise-of-crypto-neobanks,0.0,873283d825415f1159af6b92b34eaf1c
2026-01-15T23:21:15Z,CoinDesk,BTC,"Bitcoin price may hit $300,000 to $1.5 million by 2030, Ark Invest Says",https://www.coindesk.com/markets/2026/01/15/lower-volatility-bigger-allocations-ark-invest-sees-bitcoin-entering-its-next-chapter,0.0,4ec5924c6c48f0d9e97d3e14f42d5d3e
2026-01-15T23:21:15Z,CoinDesk,ALL,Tom Lee's Bitmine Immersion invests $200 million in YouTube star MrBeast’s company,https://www.coindesk.com/business/2026/01/15/tom-lee-s-bitmine-invests-usd200-million-in-billionaire-youtube-star-mrbeast-s-company,0.0,32d05646661b5862c790b6c025efb6bf
2026-01-15T23:21:15Z,CoinDesk,BTC,Bitcoin rises despite Senate cancelling crypto bill hearing: Crypto Daybook Americas,https://www.coindesk.com/daybook-us/2026/01/15/bitcoin-rises-oil-falls-as-global-tensions-ease-crypto-daybook-americas,0.1511,a688af9c66c088cf564710d8dab54e56
2026-01-15T23:21:15Z,CoinDesk,ALL,Strategy’s preferred 'STRC' drops below par after ex dividend date,https://www.coindesk.com/markets/2026/01/15/strategy-s-preferred-strc-drops-below-par-after-ex-dividend-date,0.0,89a0e4ab41ffdb772270aa0114cde2e5
2026-01-15T23:21:15Z,Cointelegraph,BTC,"Bitcoin rally collapses at $97K as funding rate stalls, retail traders sit out",https://cointelegraph.com/news/bitcoin-rally-collapses-at-97k-as-funding-rate-stalls-retail-traders-sit-out?utm_source=rss_feed&utm_medium=rss&utm_campaign=rss_partner_inbound,-0.8176,8dbc548bc799d53304dfbf4c862b67a9
2026-01-15T23:21:15Z,Cointelegraph,BTC,Here’s what happened in crypto today,https://cointelegraph.com/news/what-happened-in-crypto-today?utm_source=rss_feed&utm_medium=rss&utm_campaign=rss_partner_inbound,0.0,d2821cec0056a7e10af9203ce051daba
2026-01-15T23:21:15Z,Cointelegraph,ETH,"ETH’s next stop could be $4.1K, but this must happen first",https://cointelegraph.com/news/eth-s-next-stop-could-be-dollar4-1k-but-this-must-happen-first?utm_source=rss_feed&utm_medium=rss&utm_campaign=rss_partner_inbound,-0.5267,22379af831674c67189c9868f5de9d19
2026-01-15T23:21:15Z,Cointelegraph,BTC,West Virginia lawmaker introduces bill to allow state crypto investments,https://cointelegraph.com/news/west-virginia-bill-treasury-digital-assets?utm_source=rss_feed&utm_medium=rss&utm_campaign=rss_partner_inbound,0.7351,120251b026c16aa08793adafa617135e
2026-01-15T23:21:15Z,Cointelegraph,BTC,Behind the ‘Bitcoin lottery’ myth: NiceHash clarifies untagged BTC blocks,https://cointelegraph.com/news/nicehash-untagged-bitcoin-blocks-solo-miner-myth?utm_source=rss_feed&utm_medium=rss&utm_campaign=rss_partner_inbound,-0.2263,27cb3bc39aef4f57b3f7fea282bad5fb
2026-01-15T23:21:15Z,Cointelegraph,ALL,Coinbase CEO expects market structure bill markup ‘in a few weeks‘,https://cointelegraph.com/news/coinbase-ceo-crypto-market-structure-bill-markup?utm_source=rss_feed&utm_medium=rss&utm_campaign=rss_partner_inbound,0.0,f1cda5102ed30fe4fb925a5041b0365b
2026-01-15T23:21:15Z,Cointelegraph,ALL,Bank of America CEO warns interest-bearing stablecoins could pull $6T from US banks,https://cointelegraph.com/news/bank-of-america-interest-bearing-stablecoins-us-banks?utm_source=rss_feed&utm_medium=rss&utm_campaign=rss_partner_inbound,0.1531,075beb0166442c177b41a24c540f84cb
2026-01-15T23:21:15Z,Cointelegraph,BTC,Bitcoin whale balances see 21% bounce after fastest sell-off since 2023 ends,https://cointelegraph.com/news/bitcoin-whale-balances-see-21percent-bounce-after-fastest-sell-off-since-2023-ends?utm_source=rss_feed&utm_medium=rss&utm_campaign=rss_partner_inbound,0.6249,92f5209a665b3a53a0d409e6d14db106
2026-01-15T23:21:15Z,Cointelegraph,ALL,US lawmakers demand action from SEC on Justin Sun enforcement case,https://cointelegraph.com/news/us-lawmakers-sec-justin-sun-case?utm_source=rss_feed&utm_medium=rss&utm_campaign=rss_partner_inbound,-0.4767,e7419a0159880ddc2f5abfe09a74292a
2026-01-15T23:21:15Z,Cointelegraph,BTC,"CME Group to expand crypto futures with Cardano, Chainlink and Stellar contracts",https://cointelegraph.com/news/cme-group-plans-launch-of-cardano-chainlink-and-stellar-futures?utm_source=rss_feed&utm_medium=rss&utm_campaign=rss_partner_inbound,0.7096,117f3984ee016a2db01984e7eea9e1cf
2026-01-15T23:21:15Z,Cointelegraph,BTC,Bitcoin’s renewed push to $100K sparked by fresh institutional demand,https://cointelegraph.com/news/bitcoin-renewed-push-100k-fresh-institutional-demand?utm_source=rss_feed&utm_medium=rss&utm_campaign=rss_partner_inbound,0.6124,c2b39011bd23e808bee34a70bc9ac342
2026-01-15T23:21:15Z,Cointelegraph,BTC,"Bitcoin must hold $94K next, says trader as BTC price dips at US open",https://cointelegraph.com/news/bitcoin-must-hold-94k-trader-btc-price-dips-us-open?utm_source=rss_feed&utm_medium=rss&utm_campaign=rss_partner_inbound,-0.4019,980ffd54e3110892cb1ca3e69242c50b
2026-01-15T23:21:15Z,Cointelegraph,ALL,These three XRP charts hint at a price rally toward $2.80,https://cointelegraph.com/news/these-three-xrp-charts-hint-at-a-price-rally-toward-2-80?utm_source=rss_feed&utm_medium=rss&utm_campaign=rss_partner_inbound,0.2023,d14c3454b9bfb883829674826b443a83
2026-01-15T23:21:15Z,Cointelegraph,ALL,UK mulls under‑16 social media ban amid rising online ID push,https://cointelegraph.com/news/uk-mulls-under-16-social-media-ban-amid-rising-online-id-push?utm_source=rss_feed&utm_medium=rss&utm_campaign=rss_partner_inbound,-0.8402,8085b7594b715a476ce9e6cdf362defa
2026-01-15T23:21:15Z,Cointelegraph,BTC,Five Bitcoin narratives analysts are watching beyond price,https://cointelegraph.com/news/five-bitcoin-narratives-analysts-are-watching-beyond-price?utm_source=rss_feed&utm_medium=rss&utm_campaign=rss_partner_inbound,0.5719,17c067c2c525c1e4bb54f359d7c72f44
2026-01-15T23:21:15Z,Cointelegraph,ALL,US crypto market structure bill in limbo as industry pulls support,https://cointelegraph.com/news/us-crypto-market-structure-bill-limbo-industry-support?utm_source=rss_feed&utm_medium=rss&utm_campaign=rss_partner_inbound,0.5574,43d6d6b4e477e365e7cad07fb66ef208
2026-01-15T23:21:15Z,Cointelegraph,ALL,SWIFT trials euro stablecoin in tokenized bond payments with SG-Forge,https://cointelegraph.com/news/sg-forge-swift-tokenized-bonds-eur-coinvertible-stablecoin?utm_source=rss_feed&utm_medium=rss&utm_campaign=rss_partner_inbound,0.6166,839b03f6793e7ed2b1b84148ca8cf648
2026-01-15T23:21:15Z,Cointelegraph,ALL,Galaxy closes first $75M blockchain-based loan deal on Avalanche,https://cointelegraph.com/news/galaxy-digital-closes-75m-tokenized-clo-on-avalanche?utm_source=rss_feed&utm_medium=rss&utm_campaign=rss_partner_inbound,0.3818,014b7cf39aa20f5ef73dcf2ce897a3b6
2026-01-15T23:21:15Z,Cointelegraph,ALL,BitMine to invest $200M in YouTuber MrBeast’s Beast Industries,https://cointelegraph.com/news/bitmine-200m-investment-mrbeast-beast-industries?utm_source=rss_feed&utm_medium=rss&utm_campaign=rss_partner_inbound,0.0,b282f49fc6471e8211934a88de8068fe
2026-01-15T23:21:15Z,Cointelegraph,ALL,How AI crypto trading will make and break human roles,https://cointelegraph.com/news/ai-crypto-trading-make-break-human-roles?utm_source=rss_feed&utm_medium=rss&utm_campaign=rss_partner_inbound,-0.128,dfb7dcc35f4548b99c95cc63b995b16f
2026-01-15T23:21:15Z,Cointelegraph,BTC,Short squeeze hits top 500 cryptos as traders unwind bearish bets,https://cointelegraph.com/news/short-squeeze-top-500-cryptos-traders-bearish-bets?utm_source=rss_feed&utm_medium=rss&utm_campaign=rss_partner_inbound,0.3818,90afc33f0bdf0acd0abee99e14ae24c6
2026-01-15T23:21:15Z,Cointelegraph,ALL,Universal blockchains buckle under real-world demands,https://cointelegraph.com/news/universal-blockchains-real-demands?utm_source=rss_feed&utm_medium=rss&utm_campaign=rss_partner_inbound,0.4019,06243755b81a9b3afad2900328fe2614
2026-01-15T23:21:15Z,Cointelegraph,ALL,Indian crypto platforms push for tax rethink ahead of February budget,https://cointelegraph.com/news/india-crypto-tax-rethink-february-union-budget?utm_source=rss_feed&utm_medium=rss&utm_campaign=rss_partner_inbound,-0.3182,e2b98ae00ebda475539f21d77f67c807
2026-01-15T23:21:15Z,Cointelegraph,BTC,Bitcoin’s $100K comeback hinges on $98K breakout and spot demand,https://cointelegraph.com/news/bitcoin-analysts-this-must-happen-100k-btc-price-comeback?utm_source=rss_feed&utm_medium=rss&utm_campaign=rss_partner_inbound,0.1779,66fe6b6a339e1cc226361367e01f9e62
2026-01-15T23:21:15Z,Cointelegraph,BTC,Sygnum sees tokenization and state Bitcoin reserves taking off in 2026,https://cointelegraph.com/news/2026-sovereign-bitcoin-reserves-tradfi-tokenization-adoption-sygnum?utm_source=rss_feed&utm_medium=rss&utm_campaign=rss_partner_inbound,0.0,152f8d5c81cc1a986fac24e069d74849
2026-01-15T23:21:15Z,Cointelegraph,BTC,Bitcoin prints classic bottom signals as BTC nears $101K reclaim,https://cointelegraph.com/news/bitcoin-bottom-signal-btc-eyes-unique-101k-bear-market-reclaim?utm_source=rss_feed&utm_medium=rss&utm_campaign=rss_partner_inbound,0.0,da151cb9054d255e6adfd68fcd72df7d
2026-01-15T23:21:15Z,Cointelegraph,ALL,LSEG brings commercial bank money onto blockchain rails with DiSH,https://cointelegraph.com/news/lseg-launches-dish-onchain-cash-settlement?utm_source=rss_feed&utm_medium=rss&utm_campaign=rss_partner_inbound,0.0,1e1c112d6f4066979e355f344ebfafef
2026-01-15T23:21:15Z,Cointelegraph,BTC,Bitcoin ETFs post biggest inflows of 2026 so far as BTC rallies above $97K,https://cointelegraph.com/news/blackrock-leads-840-million-bitcoin-etf-inflows?utm_source=rss_feed&utm_medium=rss&utm_campaign=rss_partner_inbound,0.4215,94182ebd5e551672730fab5202b580dd
2026-01-15T23:21:15Z,Cointelegraph,BTC,Lemon launches Bitcoin-backed credit card in cash-hoarding Argentina,https://cointelegraph.com/news/bitcoin-backed-credit-card-argentina-lemon?utm_source=rss_feed&utm_medium=rss&utm_campaign=rss_partner_inbound,0.872,e481d1716d8e98a6440bc819865b47a7
2026-01-15T23:21:15Z,Cointelegraph,ALL,DeFi quietly breaks up with Discord as scams overwhelm public channels,https://cointelegraph.com/news/defi-protocols-exit-discord-scams-support-channels?utm_source=rss_feed&utm_medium=rss&utm_campaign=rss_partner_inbound,-0.9136,2f2879b947a74d39015f6d9f6271e9ff
2026-01-15T23:21:15Z,CryptoSlate,BTC,Why Wall Street refuses to sell Bitcoin – and actually bought way more – even while losing 25% of its value,https://cryptoslate.com/why-wall-street-refuses-to-sell-bitcoin-and-actually-bought-way-more-even-while-losing-25-of-its-value/,0.7872,565c4b8caa2f53131522600a8c1187e2
2026-01-15T23:21:15Z,CryptoSlate,ALL,SEC Chair predicts 2-year timeline to put US fully on chain but the real $12.6 trillion opportunity isn’t equities,https://cryptoslate.com/sec-chair-predicts-2-year-timeline-to-full-tokenization-but-the-real-12-6-trillion-opportunity-isnt-equities/,0.8126,850eec012ab8fbb660deb54c6c4f33da
2026-01-15T23:21:15Z,CryptoSlate,BTC,"Bitcoin demand is breaking out, but dealers are mechanically forcing stability: Here is the exact price the dam cracks",https://cryptoslate.com/bitcoin-demand-is-breaking-out-but-dealers-are-mechanically-forcing-stability-here-is-the-exact-price-the-dam-fails/,-0.4118,3c4e8f98214afde1c1456af885107a45
2026-01-15T23:21:15Z,CryptoSlate,BTC,Get access to Strategy’s 11% Bitcoin dividends without owning the stock through this new token,https://cryptoslate.com/earning-11-yield-from-strategys-bitcoin-credit-machine-routed-to-new-stablecoin-usdat-rewards/,0.3818,d42c03f423ed81b4c72432e237a0f88f
2026-01-15T23:21:15Z,CryptoSlate,ALL,Ripple’s massive license victory hides a structural shift that could actually divert volume away from XRP,https://cryptoslate.com/ripples-massive-license-victory-hides-a-structural-shift-that-could-actually-divert-volume-away-from-xrp/,0.2732,719693917102452ceef2b40bc3e29a0a
2026-01-15T23:21:15Z,CryptoSlate,ETH,Ethereum’s surprising usage drop suggests the network solved the wrong problem with Fusaka upgrade,https://cryptoslate.com/ethereum-fusakas-new-21-blob-ceiling-looks-tempting-but-blocks-above-16-show-a-worrying-miss-rate-jump/,-0.8834,ca5f5deeeedd2fcb0f383333c637c6da
2026-01-15T23:21:15Z,CryptoSlate,BTC,"Bitcoin price is exploding, and a rare “gamma squeeze” suggests the price action is about to get violent",https://cryptoslate.com/bitcoin-price-is-exploding-and-a-rare-gamma-squeeze-suggests-the-price-action-is-about-to-get-violent/,0.4019,180eaf4fad38f062cdba2454875c193c
2026-01-15T23:21:15Z,CryptoSlate,ALL,Solana’s public attack on Starknet exposes how billions in “mercenary” volume are artificially pumping network valuations right now,https://cryptoslate.com/solanas-public-attack-on-starknet-exposes-how-billions-in-mercenary-volume-are-artificially-pumping-network-valuations-right-now/,-0.8834,b43ce53ab48d72dee80ca437abce3eda
2026-01-15T23:21:15Z,CryptoSlate,ETH,Ethereum faces a dangerous 40-day deadlock after BitMine’s aggressive staking forces a historic liquidity squeeze,https://cryptoslate.com/ethereum-faces-a-dangerous-40-day-deadlock-after-bitmines-aggressive-staking-forced-a-historic-liquidity-squeeze/,-0.8402,3bc6cc9d72fa2ed0051c7eddd103acd1
2026-01-15T23:21:15Z,CryptoSlate,BTC,"Bitcoin just wiped out $600 million in bets, triggering a “mechanical” loop that forces prices toward $100k",https://cryptoslate.com/bitcoin-just-wiped-out-600-million-in-bets-triggering-a-mechanical-loop-that-forces-prices-toward-100k/,0.2263,902ecc8d28f832ab10b8c9abd26766b6
