ts_utc,source,crypto,title,link,sentiment,id
2026-01-15T16:35:27Z,CoinDesk,ALL,Bank of America CEO says stablecoins could drain trillions in bank deposits,https://www.coindesk.com/business/2026/01/15/bank-of-america-ceo-says-stablecoins-could-drain-trillions-in-bank-deposits,0.0,b42325369dcd5928dfef426bd8f0d4ed
2026-01-15T16:35:27Z,CoinDesk,ALL,"Crypto bill delay 'may ultimately be constructive' for final product, Benchmark says",https://www.coindesk.com/policy/2026/01/15/crypto-bill-delay-may-ultimately-be-constructive-for-final-product-benchmark-says,-0.3182,a692472ff2d47010ba5a9ba2e68ce720
2026-01-15T16:35:27Z,CoinDesk,ALL,JPMorgan sees 2026 crypto inflows topping the $130 billion hit in 2025,https://www.coindesk.com/markets/2026/01/15/jpmorgan-sees-2026-crypto-inflows-topping-the-usd130-billion-hit-in-2025,0.0,5a6874b1a17867cf03d8912267d141ba
2026-01-15T16:35:27Z,CoinDesk,ALL,"CoinDesk 20 Performance Update: Uniswap (UNI) Drops 4.6%, Leading Index Lower",https://www.coindesk.com/coindesk-indices/2026/01/15/coindesk-20-performance-update-uniswap-uni-drops-4-6-leading-index-lower,-0.296,5f42d93beca2b9715b6f879d666a2537
2026-01-15T16:35:27Z,CoinDesk,ALL,Stablecoins and self-custody are driving the rise of crypto neobanks,https://www.coindesk.com/tech/2026/01/15/stablecoins-and-self-custody-are-driving-the-rise-of-crypto-neobanks,0.0,873283d825415f1159af6b92b34eaf1c
2026-01-15T16:35:27Z,CoinDesk,BTC,"Lower volatility, bigger allocations: Ark Invest sees bitcoin entering its next chapter",https://www.coindesk.com/markets/2026/01/15/lower-volatility-bigger-allocations-ark-invest-sees-bitcoin-entering-its-next-chapter,-0.296,e20757f5a8e9c405ec73baaeeee1364b
2026-01-15T16:35:27Z,CoinDesk,ALL,Tom Lee's Bitmine Immersion invests $200 million in YouTube star MrBeast’s company,https://www.coindesk.com/business/2026/01/15/tom-lee-s-bitmine-invests-usd200-million-in-billionaire-youtube-star-mrbeast-s-company,0.0,32d05646661b5862c790b6c025efb6bf
2026-01-15T16:35:27Z,CoinDesk,BTC,Bitcoin rises despite Senate cancelling crypto bill hearing: Crypto Daybook Americas,https://www.coindesk.com/daybook-us/2026/01/15/bitcoin-rises-oil-falls-as-global-tensions-ease-crypto-daybook-americas,0.1511,a688af9c66c088cf564710d8dab54e56
2026-01-15T16:35:27Z,CoinDesk,ALL,Strategy’s preferred 'STRC' drops below par after ex dividend date,https://www.coindesk.com/markets/2026/01/15/strategy-s-preferred-strc-drops-below-par-after-ex-dividend-date,0.0,89a0e4ab41ffdb772270aa0114cde2e5
2026-01-15T16:35:27Z,CoinDesk,ALL,Societe Generale works with Swift to settle tokenize bonds using cash and stablecoins,https://www.coindesk.com/business/2026/01/15/societe-generale-works-with-swift-to-settle-tokenize-bonds-using-cash-and-stablecoins,0.2023,a77d9ff2eeaabf55060a5165423b9cc3
2026-01-15T16:35:27Z,CoinDesk,BTC,Bitcoin spot demand builds as short squeeze risk increases,https://www.coindesk.com/markets/2026/01/15/bitcoin-spot-demand-builds-as-short-squeeze-risk-increases,-0.3818,9cd2f575f59eae24899522b1ee06a218
2026-01-15T16:35:27Z,CoinDesk,BTC,Bitcoin consolidates above key support as profit-taking hits altcoins: Crypto Markets Today,https://www.coindesk.com/markets/2026/01/15/bitcoin-consolidates-above-key-support-as-profit-taking-hits-altcoins-crypto-markets-today,0.4019,65480da8899baccb9f4c7bd2e1533780
2026-01-15T16:35:27Z,CoinDesk,ALL,Post-quantum crypto startup Project Eleven raises $20 million in funding round,https://www.coindesk.com/business/2026/01/15/post-quantum-crypto-startup-project-eleven-raises-usd20-million-in-funding-round,0.0,11e1d943cbee924ef5aca48104e85dba
2026-01-15T16:35:27Z,CoinDesk,BTC,Bitcoin bull case grows as U.S. bond market volatility sinks to lowest since 2021,https://www.coindesk.com/markets/2026/01/15/bitcoin-bull-case-grows-as-u-s-bond-market-volatility-sinks-to-lowest-since-2021,-0.3818,1cedb6a6ae7b6cfa737b5c01a3958565
2026-01-15T16:35:27Z,CoinDesk,ALL,Miami’s crypto-settled real estate record broken by $14 million USDT transaction,https://www.coindesk.com/business/2026/01/14/miami-s-crypto-settled-real-estate-record-broken-by-usd14m-usdt-transaction,-0.4767,6f83f6172e9dc9bbd8d492c7de8aaa3e
2026-01-15T16:35:27Z,CoinDesk,BTC,"Bitcoin ETFs take in $830 million amid positive inflows across ether, solana and XRP",https://www.coindesk.com/markets/2026/01/15/bitcoin-etfs-take-in-usd830-million-amid-positive-inflows-across-ether-solana-and-xrp,0.5574,f5510af1754af9ff0ac7f22950f1ca39
2026-01-15T16:35:27Z,CoinDesk,ALL,Crypto market turns greedy after three-month break,https://www.coindesk.com/markets/2026/01/15/crypto-sentiment-flips-to-greed-for-first-time-since-october-selloff,-0.3182,13e8e0fa285696b6278e301683058d13
2026-01-15T16:35:27Z,CoinDesk,ALL,NCAA urges CFTC to pause college sports prediction markets,https://www.coindesk.com/policy/2026/01/15/ncaa-urges-cftc-to-pause-college-sports-prediction-markets,0.0,1d3cb8bea1dd81832f42b35a88446637
2026-01-15T16:35:27Z,CoinDesk,BTC,Bitcoin's long-term holders are now selling at a slower pace amid rally,https://www.coindesk.com/markets/2026/01/15/long-term-bitcoin-holders-sell-less-than-in-2025-in-a-bullish-sign-for-prices,0.0,b04e60e3ba741bc34365191411f62341
2026-01-15T16:35:27Z,CoinDesk,ALL,Dogecoin drops 4% as traders sell into strength,https://www.coindesk.com/markets/2026/01/15/dogecoin-drops-4-as-traders-sell-into-strength,0.4939,2bcd7ca35d700f949344f9170e336836
2026-01-15T16:35:27Z,CoinDesk,BTC,XRP slips 3% despite Ripple license approvals as bitcoin weighs on market,https://www.coindesk.com/markets/2026/01/15/xrp-slips-3-despite-ripple-license-approvals-as-bitcoin-weighs-on-market,0.0,e7aff87688fa0f9015663f04b3ca8d9f
2026-01-15T16:35:27Z,CoinDesk,BTC,Former 'bitcoin mayor' Eric Adams denies profiting from NYC Token after 80% crash,https://www.coindesk.com/markets/2026/01/15/former-bitcoin-mayor-eric-adams-denies-profiting-from-nyc-token-after-80-crash,-0.4404,7ef7a7cbc784bbbb2b627b3cb160ed4a
2026-01-15T16:35:27Z,CoinDesk,BTC,"Bitcoin at risk of dropping under $96,000 as U.S.-Iran rhetoric pressures risk assets",https://www.coindesk.com/markets/2026/01/15/bitcoin-at-risk-of-dropping-under-usd96-000-as-u-s-iran-rhetoric-pressures-risk-assets,-0.5859,82cb63a44c72b82ae4f0fd5cc554ea3e
2026-01-15T16:35:27Z,CoinDesk,ALL,Senate Banking Committee cancels crypto market structure markup,https://www.coindesk.com/policy/2026/01/14/senate-banking-committee-cancels-crypto-market-structure-markup,-0.2263,11b5ec0a17135cf3336d2edd2013ab27
2026-01-15T16:35:27Z,CoinDesk,ALL,"New Polymarket bettor places $40,000 on U.S. striking Iran tonight",https://www.coindesk.com/markets/2026/01/14/new-polymarket-bettor-places-usd40-000-on-u-s-striking-iran-tonight,0.0,09b56c471349a985161c076ffc3b76eb
2026-01-15T16:35:27Z,Cointelegraph,BTC,"Bitcoin must hold $94K next, says trader as BTC price dips at US open",https://cointelegraph.com/news/bitcoin-must-hold-94k-trader-btc-price-dips-us-open?utm_source=rss_feed&utm_medium=rss&utm_campaign=rss_partner_inbound,-0.4019,980ffd54e3110892cb1ca3e69242c50b
2026-01-15T16:35:27Z,Cointelegraph,ALL,These three XRP charts hint at a price rally toward $2.80,https://cointelegraph.com/news/these-three-xrp-charts-hint-at-a-price-rally-toward-2-80?utm_source=rss_feed&utm_medium=rss&utm_campaign=rss_partner_inbound,0.2023,d14c3454b9bfb883829674826b443a83
2026-01-15T16:35:27Z,Cointelegraph,BTC,Here’s what happened in crypto today,https://cointelegraph.com/news/what-happened-in-crypto-today?utm_source=rss_feed&utm_medium=rss&utm_campaign=rss_partner_inbound,0.0,d2821cec0056a7e10af9203ce051daba
2026-01-15T16:35:27Z,Cointelegraph,ALL,UK mulls under‑16 social media ban amid rising online ID push,https://cointelegraph.com/news/uk-mulls-under-16-social-media-ban-amid-rising-online-id-push?utm_source=rss_feed&utm_medium=rss&utm_campaign=rss_partner_inbound,-0.8402,8085b7594b715a476ce9e6cdf362defa
2026-01-15T16:35:27Z,Cointelegraph,BTC,Five Bitcoin narratives analysts are watching beyond price,https://cointelegraph.com/news/five-bitcoin-narratives-analysts-are-watching-beyond-price?utm_source=rss_feed&utm_medium=rss&utm_campaign=rss_partner_inbound,0.5719,17c067c2c525c1e4bb54f359d7c72f44
2026-01-15T16:35:27Z,Cointelegraph,ALL,US crypto market structure bill in limbo as industry pulls support,https://cointelegraph.com/news/us-crypto-market-structure-bill-limbo-industry-support?utm_source=rss_feed&utm_medium=rss&utm_campaign=rss_partner_inbound,0.5574,43d6d6b4e477e365e7cad07fb66ef208
2026-01-15T16:35:27Z,Cointelegraph,ALL,SWIFT trials euro stablecoin in tokenized bond payments with SG-Forge,https://cointelegraph.com/news/sg-forge-swift-tokenized-bonds-eur-coinvertible-stablecoin?utm_source=rss_feed&utm_medium=rss&utm_campaign=rss_partner_inbound,0.6166,839b03f6793e7ed2b1b84148ca8cf648
2026-01-15T16:35:27Z,Cointelegraph,ALL,Galaxy closes first $75M blockchain-based loan deal on Avalanche,https://cointelegraph.com/news/galaxy-digital-closes-75m-tokenized-clo-on-avalanche?utm_source=rss_feed&utm_medium=rss&utm_campaign=rss_partner_inbound,0.3818,014b7cf39aa20f5ef73dcf2ce897a3b6
2026-01-15T16:35:27Z,Cointelegraph,ALL,BitMine to invest $200M in YouTuber MrBeast’s Beast Industries,https://cointelegraph.com/news/bitmine-200m-investment-mrbeast-beast-industries?utm_source=rss_feed&utm_medium=rss&utm_campaign=rss_partner_inbound,0.0,b282f49fc6471e8211934a88de8068fe
2026-01-15T16:35:27Z,Cointelegraph,ALL,How AI crypto trading will make and break human roles,https://cointelegraph.com/news/ai-crypto-trading-make-break-human-roles?utm_source=rss_feed&utm_medium=rss&utm_campaign=rss_partner_inbound,-0.128,dfb7dcc35f4548b99c95cc63b995b16f
2026-01-15T16:35:27Z,Cointelegraph,BTC,Short squeeze hits top 500 cryptos as traders unwind bearish bets,https://cointelegraph.com/news/short-squeeze-top-500-cryptos-traders-bearish-bets?utm_source=rss_feed&utm_medium=rss&utm_campaign=rss_partner_inbound,0.3818,90afc33f0bdf0acd0abee99e14ae24c6
2026-01-15T16:35:27Z,Cointelegraph,ALL,Universal blockchains buckle under real-world demands,https://cointelegraph.com/news/universal-blockchains-real-demands?utm_source=rss_feed&utm_medium=rss&utm_campaign=rss_partner_inbound,0.4019,06243755b81a9b3afad2900328fe2614
2026-01-15T16:35:27Z,Cointelegraph,ALL,Indian crypto platforms push for tax rethink ahead of February budget,https://cointelegraph.com/news/india-crypto-tax-rethink-february-union-budget?utm_source=rss_feed&utm_medium=rss&utm_campaign=rss_partner_inbound,-0.3182,e2b98ae00ebda475539f21d77f67c807
2026-01-15T16:35:27Z,Cointelegraph,BTC,Bitcoin’s $100K comeback hinges on $98K breakout and spot demand,https://cointelegraph.com/news/bitcoin-analysts-this-must-happen-100k-btc-price-comeback?utm_source=rss_feed&utm_medium=rss&utm_campaign=rss_partner_inbound,0.1779,66fe6b6a339e1cc226361367e01f9e62
2026-01-15T16:35:27Z,Cointelegraph,BTC,Sygnum sees tokenization and state Bitcoin reserves taking off in 2026,https://cointelegraph.com/news/2026-sovereign-bitcoin-reserves-tradfi-tokenization-adoption-sygnum?utm_source=rss_feed&utm_medium=rss&utm_campaign=rss_partner_inbound,0.0,152f8d5c81cc1a986fac24e069d74849
2026-01-15T16:35:27Z,Cointelegraph,BTC,Bitcoin prints classic bottom signals as BTC nears $101K reclaim,https://cointelegraph.com/news/bitcoin-bottom-signal-btc-eyes-unique-101k-bear-market-reclaim?utm_source=rss_feed&utm_medium=rss&utm_campaign=rss_partner_inbound,0.0,da151cb9054d255e6adfd68fcd72df7d
2026-01-15T16:35:27Z,Cointelegraph,ALL,LSEG brings commercial bank money onto blockchain rails with DiSH,https://cointelegraph.com/news/lseg-launches-dish-onchain-cash-settlement?utm_source=rss_feed&utm_medium=rss&utm_campaign=rss_partner_inbound,0.0,1e1c112d6f4066979e355f344ebfafef
2026-01-15T16:35:27Z,Cointelegraph,BTC,Bitcoin ETFs post biggest inflows of 2026 so far as BTC rallies above $97K,https://cointelegraph.com/news/blackrock-leads-840-million-bitcoin-etf-inflows?utm_source=rss_feed&utm_medium=rss&utm_campaign=rss_partner_inbound,0.4215,94182ebd5e551672730fab5202b580dd
2026-01-15T16:35:27Z,Cointelegraph,BTC,Lemon launches Bitcoin-backed credit card in cash-hoarding Argentina,https://cointelegraph.com/news/bitcoin-backed-credit-card-argentina-lemon?utm_source=rss_feed&utm_medium=rss&utm_campaign=rss_partner_inbound,0.872,e481d1716d8e98a6440bc819865b47a7
2026-01-15T16:35:27Z,Cointelegraph,ALL,DeFi quietly breaks up with Discord as scams overwhelm public channels,https://cointelegraph.com/news/defi-protocols-exit-discord-scams-support-channels?utm_source=rss_feed&utm_medium=rss&utm_campaign=rss_partner_inbound,-0.9136,2f2879b947a74d39015f6d9f6271e9ff
2026-01-15T16:35:27Z,Cointelegraph,ALL,"Crypto slump hits ARK ETFs in Q4, Coinbase becomes top detractor",https://cointelegraph.com/news/crypto-market-slide-hits-ark-etfs-coinbase-roblox-drag?utm_source=rss_feed&utm_medium=rss&utm_campaign=rss_partner_inbound,0.5267,1fd857dcd7c73d88df106d5834fcbdb8
2026-01-15T16:35:27Z,Cointelegraph,BTC,"Bitcoin open interest falls 30%, setting up bullish recovery: Analyst",https://cointelegraph.com/news/bitcoin-oi-falls-30-resetting-markets-bullish-recovery-cryptoquant?utm_source=rss_feed&utm_medium=rss&utm_campaign=rss_partner_inbound,0.8402,f237672a6c18a3f52e620ce800ff788b
2026-01-15T16:35:27Z,Cointelegraph,BTC,"Bitcoin ‘groove’ to return despite gold, Nasdaq spotlight: Arthur Hayes",https://cointelegraph.com/news/bitcoin-will-get-groove-back-despite-soaring-gold-and-nasdaq-arthur-hayes?utm_source=rss_feed&utm_medium=rss&utm_campaign=rss_partner_inbound,-0.0772,c986c3dfd2889ec2721c246ba125e689
2026-01-15T16:35:27Z,Cointelegraph,ALL,Blockchain firm eyes $200M in tokenized water projects across Asia,https://cointelegraph.com/news/200m-tokenized-water-infrastructure-plan-southeast-asia?utm_source=rss_feed&utm_medium=rss&utm_campaign=rss_partner_inbound,0.3612,2234b6459b869dd932416f132c72a029
2026-01-15T16:35:27Z,Cointelegraph,ALL,Ex-NYC mayor Eric Adams denies moving money out of controversial token,https://cointelegraph.com/news/ex-nyc-mayor-eric-adams-denies-profiting-from-token?utm_source=rss_feed&utm_medium=rss&utm_campaign=rss_partner_inbound,-0.4939,3d0676b3ae2092ec4a2a36443be12769
2026-01-15T16:35:27Z,Cointelegraph,ALL,Crypto Fear & Greed index flips to ‘greed’ for first time since October,https://cointelegraph.com/news/crypto-fear-greed-hits-greed-bitcoin-two-month-high?utm_source=rss_feed&utm_medium=rss&utm_campaign=rss_partner_inbound,-0.8442,80fab605a72a902d451cf99dd382e14a
2026-01-15T16:35:27Z,Cointelegraph,ALL,"Russia plans limited crypto access for retail investors, lawmaker says",https://cointelegraph.com/news/russia-bill-open-crypto-aims-common-occurrence-report?utm_source=rss_feed&utm_medium=rss&utm_campaign=rss_partner_inbound,-0.25,8cb5ea0f190e52c5076cf39a4cd6baed
2026-01-15T16:35:27Z,Cointelegraph,ALL,Crypto industry split over CLARITY Act after Coinbase breaks ranks,https://cointelegraph.com/news/crypto-industry-split-over-clarity-act?utm_source=rss_feed&utm_medium=rss&utm_campaign=rss_partner_inbound,0.5948,3a59257155811f695090e0e9bb2a060c
2026-01-15T16:35:27Z,Cointelegraph,ALL,"Solana Mobile to airdrop 1.8B SKR tokens to users, 141M to devs",https://cointelegraph.com/news/solana-mobile-airdrop-nearly-2b-seeker-users-and-devs?utm_source=rss_feed&utm_medium=rss&utm_campaign=rss_partner_inbound,0.0,d68f950bf0cd1235fa1fadfd21ab3f7d
2026-01-15T16:35:27Z,Cointelegraph,ALL,US Senate Banking postpones Thursday crypto bill markup amid negotiations,https://cointelegraph.com/news/us-senate-banking-cancels-thursday-crypto-bill-markup-for-negotiations?utm_source=rss_feed&utm_medium=rss&utm_campaign=rss_partner_inbound,-0.128,62716744d9eaa4ed9224546f04fa7566
2026-01-15T16:35:27Z,CryptoSlate,BTC,Get access to Strategy’s 11% Bitcoin dividends without owning the stock through this new token,https://cryptoslate.com/earning-11-yield-from-strategys-bitcoin-credit-machine-routed-to-new-stablecoin-usdat-rewards/,0.3818,d42c03f423ed81b4c72432e237a0f88f
2026-01-15T16:35:27Z,CryptoSlate,ALL,Ripple’s massive license victory hides a structural shift that could actually divert volume away from XRP,https://cryptoslate.com/ripples-massive-license-victory-hides-a-structural-shift-that-could-actually-divert-volume-away-from-xrp/,0.2732,719693917102452ceef2b40bc3e29a0a
2026-01-15T16:35:27Z,CryptoSlate,ETH,Ethereum’s surprising usage drop suggests the network solved the wrong problem with Fusaka upgrade,https://cryptoslate.com/ethereum-fusakas-new-21-blob-ceiling-looks-tempting-but-blocks-above-16-show-a-worrying-miss-rate-jump/,-0.8834,ca5f5deeeedd2fcb0f383333c637c6da
2026-01-15T16:35:27Z,CryptoSlate,BTC,"Bitcoin price is exploding, and a rare “gamma squeeze” suggests the price action is about to get violent",https://cryptoslate.com/bitcoin-price-is-exploding-and-a-rare-gamma-squeeze-suggests-the-price-action-is-about-to-get-violent/,0.4019,180eaf4fad38f062cdba2454875c193c
2026-01-15T16:35:27Z,CryptoSlate,ALL,Solana’s public attack on Starknet exposes how billions in “mercenary” volume are artificially pumping network valuations right now,https://cryptoslate.com/solanas-public-attack-on-starknet-exposes-how-billions-in-mercenary-volume-are-artificially-pumping-network-valuations-right-now/,-0.8834,b43ce53ab48d72dee80ca437abce3eda
2026-01-15T16:35:27Z,CryptoSlate,ETH,Ethereum faces a dangerous 40-day deadlock after BitMine’s aggressive staking forces a historic liquidity squeeze,https://cryptoslate.com/ethereum-faces-a-dangerous-40-day-deadlock-after-bitmines-aggressive-staking-forced-a-historic-liquidity-squeeze/,-0.8402,3bc6cc9d72fa2ed0051c7eddd103acd1
2026-01-15T16:35:27Z,CryptoSlate,BTC,"Bitcoin just wiped out $600 million in bets, triggering a “mechanical” loop that forces prices toward $100k",https://cryptoslate.com/bitcoin-just-wiped-out-600-million-in-bets-triggering-a-mechanical-loop-that-forces-prices-toward-100k/,0.2263,902ecc8d28f832ab10b8c9abd26766b6
2026-01-15T16:35:27Z,CryptoSlate,ALL,"Crypto yields expose the exact amount banks are underpaying you, and why they want Congress to ban it",https://cryptoslate.com/stablecoin-yields-expose-the-exact-amount-banks-are-underpaying-you-and-why-they-want-congress-to-ban-it/,-0.9112,b06d1cff379e6f8a6bd165dc48ca1d0d
2026-01-15T16:35:27Z,CryptoSlate,BTC,Data reveals the new “sweet spot” for crypto in your portfolio as financial advisors flip aggressive on Bitcoin,https://cryptoslate.com/financial-advisors-flip-aggressive-on-bitcoin-as-data-reveals-the-new-sweet-spot-for-crypto-holdings/,-0.2023,6212ee9a093a5e648b04e5bf8696d07e
2026-01-15T16:35:27Z,CryptoSlate,BTC,"Bitcoin ignored Trump’s latest 25% tariff threat, but the $19B liquidation ghost from October is quietly resetting in the shadows",https://cryptoslate.com/bitcoin-ignored-trumps-new-25-tariff-threat-this-time-but-the-19b-liquidation-ghost-from-october-is-quietly-resetting-in-the-shadows/,-0.9615,1b78929476c14b51d84e1b778c471a0b
