ts_utc,source,crypto,title,link,sentiment,id
2026-01-05T06:39:13Z,CoinDesk,BTC,Bitcoin eyes longest daily winning streak in 3 months,https://www.coindesk.com/markets/2026/01/05/bitcoin-eyes-longest-daily-winning-streak-in-3-months,0.5267,ccba195fbbfc1c49b35f38fff0aeef90
2026-01-05T06:39:13Z,CoinDesk,ALL,XRP breaks $2.12 as shrinking exchange supply lead to price squeeze higher,https://www.coindesk.com/markets/2026/01/05/xrp-breaks-usd2-12-as-shrinking-exchange-supply-lead-to-price-squeeze-higher,0.0,cf9bfa1292e66367695e64bcf24f47db
2026-01-05T06:39:13Z,CoinDesk,ALL,PwC deepens crypto push as U.S. rules shift and stablecoins go mainstream: Report,https://www.coindesk.com/markets/2026/01/05/pwc-deepens-crypto-push-as-u-s-rules-shift-and-stablecoins-go-mainstream-report,0.0,cc27c4ce384ddeca735f8dfff5842163
2026-01-05T06:39:13Z,CoinDesk,BTC,"Bitcoin briefly hits $93,000 as crypto market extends new year rally with $260 million in liquidations",https://www.coindesk.com/markets/2026/01/05/crypto-markets-continue-new-year-run-as-bitcoin-briefly-hits-usd93k-ether-rallies,0.128,2b5c909e79bedcefeac08703c5660218
2026-01-05T06:39:13Z,CoinDesk,BTC,Asia Morning Briefing: Data shows legacy media took a more balanced view of bitcoin in 2025,https://www.coindesk.com/markets/2026/01/05/asia-morning-briefing-data-shows-legacy-media-took-a-more-balanced-view-of-bitcoin-in-2025,0.0,f05be9321e8c7abf92d627c502580f36
2026-01-05T06:39:13Z,CoinDesk,ETH,"Neobanks will fuel Ethereum's 2026 growth, says ether.fi CEO",https://www.coindesk.com/tech/2026/01/04/neobanks-will-fuel-ethereum-s-2026-growth-says-ether-fi-ceo,0.3818,ec53aaff703bef0f7cc2346feeb16780
2026-01-05T06:39:13Z,CoinDesk,ALL,Dogecoin pops 4% amid memecoin rally as a short-term golden cross flashes,https://www.coindesk.com/markets/2026/01/04/dogecoin-pops-4-amid-memecoin-rally-as-a-short-term-golden-cross-flashes,0.0,aa2d4d3e3c394022479e97e6d0bbc497
2026-01-05T06:39:13Z,CoinDesk,BTC,"Bitcoin tops $91,000 with ether, dogecoin higher amid U.S. action on Venezuela",https://www.coindesk.com/markets/2026/01/04/bitcoin-tops-usd91-000-with-ether-dogecoin-higher-amid-u-s-action-on-venezuela,0.5106,cec316dd9d57c1fa25cb7a32b8478125
2026-01-05T06:39:13Z,CoinDesk,ETH,Ethereum and Solana set the stage for 2026’s DeFi reboot,https://www.coindesk.com/tech/2026/01/03/ethereum-and-solana-set-the-stage-for-2026-s-defi-reboot,0.0,78715bd453ac043e89793c1cea941c11
2026-01-05T06:39:13Z,CoinDesk,BTC,"Bitcoin dips, but quickly recovers as U.S. captures Venezuela's Maduro",https://www.coindesk.com/markets/2026/01/03/bitcoin-dips-but-quickly-recovers-as-venezuela-s-maduro-captured,0.0,5f093961ebd2b3bc28bc195f3ce415c6
2026-01-05T06:39:13Z,CoinDesk,ALL,What next for Ripple-linked XRP as price zooms above $2,https://www.coindesk.com/markets/2026/01/03/what-next-for-ripple-linked-xrp-as-price-zooms-above-usd2,0.0,49d9d3d42c72ee39df22ca7d0bf8df51
2026-01-05T06:39:13Z,CoinDesk,ALL,"Dogecoin, PEPE rocket as much as 25% as 2026 starts with a bang for memecoins",https://www.coindesk.com/markets/2026/01/03/dogecoin-spikes-11-pepe-jumps-25-as-2026-brings-starts-with-a-bang-for-memecoins,0.0,bb62f60ef8b055345b6c3e26cb3bd063
2026-01-05T06:39:13Z,CoinDesk,ALL,XRP jumps 8% above $2 as traders bet on a friendlier SEC,https://www.coindesk.com/markets/2026/01/03/xrp-jumps-8-above-usd2-as-traders-bet-on-a-friendlier-sec,0.4588,668c6d15faa7d11fef5723bbd1d62d56
2026-01-05T06:39:13Z,CoinDesk,ALL,Bitfinex hacker Ilya Lichtenstein credits Trump’s First Step Act for early prison release,https://www.coindesk.com/tech/2026/01/02/crypto-hacker-ilya-lichtenstein-credits-trump-s-first-step-act-for-early-prison-release,-0.2023,095c977f6ca0e16277d7ae8b31a984f0
2026-01-05T06:39:13Z,CoinDesk,ALL,Tom Lee urges BitMine shareholders to approve share increase ahead of January 14 vote,https://www.coindesk.com/business/2026/01/02/tom-lee-urges-bitmine-shareholders-to-approve-share-increase-ahead-of-jan-14-vote,0.5423,d17da5881fd788ad6ed157140d73689f
2026-01-05T06:39:13Z,CoinDesk,BTC,"Bitcoin pushes above $90,000 as traders eye change in pattern",https://www.coindesk.com/markets/2026/01/02/bitcoin-pushes-above-usd90-000-as-traders-eye-change-in-pattern,0.0,fe58c21521e5206d9a1b64aea53dd684
2026-01-05T06:39:13Z,CoinDesk,ALL,$110 billion in crypto left South Korea in 2025 owing to strict trading rules,https://www.coindesk.com/business/2026/01/02/usd110-billion-in-crypto-left-south-korea-in-2025-owing-to-strict-trading-rules,0.0,12c38f9094d45f7298be98d16c24fbf5
2026-01-05T06:39:13Z,CoinDesk,BTC,Bitcoin miner Bitfarms exiting Latin America with $30M sale of Paraguay site,https://www.coindesk.com/business/2026/01/02/bitcoin-miner-bitfarms-to-exit-latin-america-with-usd30m-sale-of-paraguay-site,0.0,252c2f1ea4564be4c21650fad21efca1
2026-01-05T06:39:13Z,CoinDesk,ALL,Iran accepts cryptocurrency as payment for advanced weapons,https://www.coindesk.com/policy/2026/01/02/iran-accepts-cryptocurrency-as-payment-for-advanced-weapons,0.1027,dfbf656e70cc133343197d033247a0d6
2026-01-05T06:39:13Z,CoinDesk,ALL,Turkmenistan legalizes crypto mining and exchanges to boost the economy,https://www.coindesk.com/policy/2026/01/02/turkmenistan-legalizes-crypto-mining-and-exchanges-to-boost-the-economy,0.4019,40e2025161550fadc26ad5255d163d7d
2026-01-05T06:39:13Z,CoinDesk,ALL,Internet Computer climbs back to $3 as short-term momentum improves,https://www.coindesk.com/markets/2026/01/02/internet-computer-climbs-back-to-usd3-as-short-term-momentum-improves,0.4215,29824ce73526321beb8aaa7471684ddb
2026-01-05T06:39:13Z,CoinDesk,ALL,BONK jumps more than 10% in 24 hours as momentum pushes price higher,https://www.coindesk.com/markets/2026/01/02/bonk-jumps-more-than-10-in-24-hours-as-momentum-pushes-price-higher,0.0,5b6a9c25f90da71747dd905fb718ca64
2026-01-05T06:39:13Z,CoinDesk,BTC,Bitcoin ETFs lose record $4.57 billion in two months,https://www.coindesk.com/markets/2026/01/02/bitcoin-etfs-lose-record-usd4-57-billion-in-two-months,-0.4019,b74c7f5011c6d4940e95dc3de8e7a576
2026-01-05T06:39:13Z,CoinDesk,BTC,Bitcoin's squeeze sets stage for major price swing,https://www.coindesk.com/markets/2026/01/02/bitcoin-s-squeeze-sets-stage-for-major-price-swing,0.0,3bd78de817299d8bdfbb89fbf523bf28
2026-01-05T06:39:13Z,CoinDesk,BTC,"Cardano's ADA pops 7%, bitcoin, ether show steady gains as traders enter 2026",https://www.coindesk.com/markets/2026/01/02/cardano-s-ada-pops-7-bitcoin-ether-show-steady-gains-as-traders-enter-2026,0.34,02257c35f7600e87e432c483f86d3773
2026-01-05T06:39:13Z,Cointelegraph,BTC,"9 myths about Bitcoin energy use, debunked by data: ESG expert",https://cointelegraph.com/news/expert-debunks-9-common-myths-about-bitcoin-mining-energy-use?utm_source=rss_feed&utm_medium=rss&utm_campaign=rss_partner_inbound,0.507,4fda7d07f4c79a40abccb88b7b0855c6
2026-01-05T06:39:13Z,Cointelegraph,ALL,"PwC leaned into crypto after US regulatory shift, CEO says",https://cointelegraph.com/news/pwc-leaning-crypto-us-regulation?utm_source=rss_feed&utm_medium=rss&utm_campaign=rss_partner_inbound,0.4927,2af625834220f46621164face315fda1
2026-01-05T06:39:13Z,Cointelegraph,ALL,Visa crypto card spending soars 525% in 2025,https://cointelegraph.com/news/net-spend-visa-crypto-cards-increased-by-525-percent-2025?utm_source=rss_feed&utm_medium=rss&utm_campaign=rss_partner_inbound,0.0,a03155a30c10587a89af93ae13025638
2026-01-05T06:39:13Z,Cointelegraph,BNB,"Whales move crypto to Binance, but buyers are missing: Analyst",https://cointelegraph.com/news/crypto-whales-deposit-binance-buyers-missing-analyst?utm_source=rss_feed&utm_medium=rss&utm_campaign=rss_partner_inbound,-0.6808,ce758cfbab92a19088085dc45e15bd1c
2026-01-05T06:39:13Z,Cointelegraph,BTC,Trump threatens military operation in Colombia as Bitcoin rises to $93K,https://cointelegraph.com/news/trump-hints-colombia-mexico-next-after-maduro-capture?utm_source=rss_feed&utm_medium=rss&utm_campaign=rss_partner_inbound,-0.6369,b57bc4322fda617eb034e94e6e71b6c6
2026-01-05T06:39:13Z,Cointelegraph,ETH,"Ethereum powers $8T in stablecoin transfers in Q4, smashing record",https://cointelegraph.com/news/stablecoin-transfer-volume-ethereum-tops-8t-q4-ath?utm_source=rss_feed&utm_medium=rss&utm_campaign=rss_partner_inbound,0.4019,4e8ab5582b7ad323a7ee683ac51e9393
2026-01-05T06:39:13Z,Cointelegraph,ETH,Ethereum ready to solve blockchain trilemma: Vitalik Buterin,https://cointelegraph.com/news/blockchain-trilemma-solved-zkevms-and-peerdas-vitalik-buterin?utm_source=rss_feed&utm_medium=rss&utm_campaign=rss_partner_inbound,0.8779,7318349b1b7124abdad4d063ac3e54fa
2026-01-05T06:39:13Z,Cointelegraph,ALL,Memecoins rip into 2026 with 23% market cap pump,https://cointelegraph.com/news/memecoins-post-holiday-rally-23-percent?utm_source=rss_feed&utm_medium=rss&utm_campaign=rss_partner_inbound,-0.2023,031f97b971d824716b4a902ead1bbdea
2026-01-05T06:39:13Z,Cointelegraph,BTC,Bitcoin devs flocked back to work amid a big year for crypto,https://cointelegraph.com/news/bitcoin-devs-flock-back-more-contributors-code?utm_source=rss_feed&utm_medium=rss&utm_campaign=rss_partner_inbound,0.4404,0bf7edc1be26c2d91033bc3fc517379b
2026-01-05T06:39:13Z,Cointelegraph,BTC,Bitcoin advocate Machado in running to replace Venezuela’s Maduro,https://cointelegraph.com/news/nobel-prize-winning-bitcoiner-in-running-to-replace-maduro?utm_source=rss_feed&utm_medium=rss&utm_campaign=rss_partner_inbound,0.0,0899f952f27eacc40bfd54e45d11acf3
2026-01-05T06:39:13Z,Cointelegraph,BTC,Here’s what happened in crypto today,https://cointelegraph.com/news/what-happened-in-crypto-today?utm_source=rss_feed&utm_medium=rss&utm_campaign=rss_partner_inbound,0.0,d2821cec0056a7e10af9203ce051daba
2026-01-05T06:39:13Z,Cointelegraph,ALL,Crypto Fear and Greed Index flips to ‘neutral’ for first time since Oct,https://cointelegraph.com/news/crypto-fear-greed-flips-neutral-first-time-oct?utm_source=rss_feed&utm_medium=rss&utm_campaign=rss_partner_inbound,-0.9647,d7bcda0d97af7c69c1e8d8ffa074c9b0
2026-01-05T06:39:13Z,Cointelegraph,ALL,"Altcoins hold ‘crucial’ support, set for ‘big leg’ up, says analyst",https://cointelegraph.com/news/altcoins-hold-crucial-support-big-leg-up?utm_source=rss_feed&utm_medium=rss&utm_campaign=rss_partner_inbound,0.7003,28e320598944989133a7da1cdcee05d7
2026-01-05T06:39:13Z,Cointelegraph,BTC,Metaplanet has key advantage over US-based Bitcoin treasuries: Analyst,https://cointelegraph.com/news/metaplanet-edge-us-dats-jpy-weakness?utm_source=rss_feed&utm_medium=rss&utm_campaign=rss_partner_inbound,0.7717,0673de5e9ee41b24e75f8f03168385a8
2026-01-05T06:39:13Z,Cointelegraph,BTC,Bitcoin ‘will move’ when TradFi reacts to Venezuela as BTC price nears $92K,https://cointelegraph.com/news/bitcoin-will-move-tradfi-reacts-venezuela-btc-price-nears-92k?utm_source=rss_feed&utm_medium=rss&utm_campaign=rss_partner_inbound,0.0,fa5b6eaa0e1d8d1f2f78c1f194c1f5a0
2026-01-05T06:39:13Z,Cointelegraph,ALL,Crypto rich threaten to leave California after new tax: Is it a bluff?,https://cointelegraph.com/news/crypto-rich-leave-california-new-tax-bluff?utm_source=rss_feed&utm_medium=rss&utm_campaign=rss_partner_inbound,0.92,9018a376a471694c9a2f5326cfea702a
2026-01-05T06:39:13Z,Cointelegraph,ALL,Wrench attacks against crypto holders are rising and growing ‘more violent’,https://cointelegraph.com/news/wrench-attacks-crypto-holders-rising-more-violent?utm_source=rss_feed&utm_medium=rss&utm_campaign=rss_partner_inbound,-0.765,f6d5ede3cd0946c6764ce38242ebbfe9
2026-01-05T06:39:13Z,Cointelegraph,ALL,Coinbase pauses local fiat rails in Argentina less than a year after its arrival,https://cointelegraph.com/news/coinbase-pauses-fiat-operations-argentina-2026?utm_source=rss_feed&utm_medium=rss&utm_campaign=rss_partner_inbound,0.0,e391057a02fcfbf9a7fc582d011e8bbd
2026-01-05T06:39:13Z,Cointelegraph,BTC,Bitcoin 'widespread correction' unlikely after US strike on Venezuela: Analyst,https://cointelegraph.com/news/united-states-venezuela-strike-bitcoin-price-downfall-unlikely-analyst?utm_source=rss_feed&utm_medium=rss&utm_campaign=rss_partner_inbound,-0.5106,2104af15a4bdeb57cc5e6131cbbe3a64
2026-01-05T06:39:13Z,Cointelegraph,ALL,Rep. Torres to target insider trading on prediction markets after bet on Maduro,https://cointelegraph.com/news/ritchie-torres-prediction-markets-insider-trading-bill-maduro-bet?utm_source=rss_feed&utm_medium=rss&utm_campaign=rss_partner_inbound,-0.3818,d1a2c7499fa319d71edc8b9489789f11
2026-01-05T06:39:13Z,Cointelegraph,BTC,Bitcoin and Ether ETFs pull in $646M on first trading day of 2026,https://cointelegraph.com/news/bitcoin-ethereum-crypto-etfs-inflows-strong?utm_source=rss_feed&utm_medium=rss&utm_campaign=rss_partner_inbound,0.0,54e1bb06d4154609ddceb2a697448b92
2026-01-05T06:39:13Z,Cointelegraph,BTC,Bitcoin's price remains resilient amid the US attack on Venezuela,https://cointelegraph.com/news/bitcoin-price-resilient-us-attack-venezuela?utm_source=rss_feed&utm_medium=rss&utm_campaign=rss_partner_inbound,-0.91,324fca3bdb7502762a1d3f6bb787a3cd
2026-01-05T06:39:13Z,Cointelegraph,BTC,"US national debt crosses $38.5T, as Bitcoiners celebrate ‘Genesis Day’",https://cointelegraph.com/news/us-national-debt-38-5-trillion-bitcoiners-genesis-day?utm_source=rss_feed&utm_medium=rss&utm_campaign=rss_partner_inbound,0.128,21426eca1bf0da1cf2817ccb88f8e4ea
2026-01-05T06:39:13Z,Cointelegraph,BTC,Hut 8 finishes 2025 strong despite difficult year for Bitcoin miners,https://cointelegraph.com/news/hut-8-2025-strong-difficult-bitcoin-miners?utm_source=rss_feed&utm_medium=rss&utm_campaign=rss_partner_inbound,0.9133,60e86a2e79271474c7094fc7bf2fc1ac
2026-01-05T06:39:13Z,Cointelegraph,BTC,Bitcoin price back at $90K: Is the bear market behind us?,https://cointelegraph.com/news/bitcoin-price-back-90k-is-the-bear-market-behind-us?utm_source=rss_feed&utm_medium=rss&utm_campaign=rss_partner_inbound,0.4329,7ac7e77b26a681f412ca3635c42da44d
2026-01-05T06:39:13Z,Cointelegraph,ALL,"Crypto phishing losses fell 83% in 2025, but drainer ecosystem ‘remains active’",https://cointelegraph.com/news/crypto-phishing-losses-fell-83-percent-2025-wallet-drainers?utm_source=rss_feed&utm_medium=rss&utm_campaign=rss_partner_inbound,-0.891,0e9f1798b15f4021c3a2fefe4c575e00
2026-01-05T06:39:13Z,Cointelegraph,BTC,Bitcoin price $90K breakout hangs in balance as US storms Venezuela,https://cointelegraph.com/news/bitcoin-price-90k-breakout-hangs-in-balance-us-storms-venezuela?utm_source=rss_feed&utm_medium=rss&utm_campaign=rss_partner_inbound,-0.3182,cdd2a661b8b7cba3399c33399f3be685
2026-01-05T06:39:13Z,Cointelegraph,ETH,"BitMine stakes $259M more ETH, pushing validator entry queue near 1M Ether",https://cointelegraph.com/news/bitmine-stakes-259m-eth-validator-queue-nears-1m?utm_source=rss_feed&utm_medium=rss&utm_campaign=rss_partner_inbound,0.0,841c05d11d3584df4633ae159db3771a
2026-01-05T06:39:13Z,Cointelegraph,BTC,"Billion-dollar Bitcoin hacker Ilya Lichtenstein released early, thanks Trump",https://cointelegraph.com/news/bitcoin-hacker-ilya-lichtenstein-released-early-first-step-act?utm_source=rss_feed&utm_medium=rss&utm_campaign=rss_partner_inbound,0.8176,784020e528f9e829647a31037b3d279c
2026-01-05T06:39:13Z,Cointelegraph,BTC,Crypto social chatter has ‘very positive’ start to 2026: Santiment,https://cointelegraph.com/news/crypto-market-sentiment-positive-retail-investors-cautious-signal-santiment?utm_source=rss_feed&utm_medium=rss&utm_campaign=rss_partner_inbound,0.0,68e22f35d620124041863e75295e61e9
2026-01-05T06:39:13Z,CryptoSlate,ALL,Washington’s new crypto bill would strip states of power – legally bans oversight that catches front-end manipulation,https://cryptoslate.com/clarity-act-heads-to-january-markup-heres-what-changes-and-what-stays-unresolved/,0.7801,e3031a2f8d021fb477952e545f371f0f
2026-01-05T06:39:13Z,CryptoSlate,BTC,"Major market maker secretly offloaded 1,213 BTC onto Binance during New Year’s Eve thin liquidity",https://cryptoslate.com/major-market-maker-secretly-offloaded-1213-btc-onto-binance-during-new-years-eve-thin-liquidity/,-0.4588,aab2c679ed47335fe4b3264bfda91e8b
2026-01-05T06:39:13Z,CryptoSlate,BTC,"European crypto trading volume is soaring, but a hidden “venue gap” is silently killing your execution price",https://cryptoslate.com/mica-euro-stablecoins-doubled-did-btc-eth-liquidity-in-europe-follow/,-0.9186,c29ce4fbcdb69498d0f983d27ea000e5
2026-01-05T06:39:13Z,CryptoSlate,ALL,Hundreds of MetaMask wallets drained: What to check before you ‘update’,https://cryptoslate.com/hundreds-of-evm-wallets-drained-what-to-check-before-you-update/,-0.8225,c11671c685662208276d3557de6b8ba7
2026-01-05T06:39:13Z,CryptoSlate,BTC,Bitcoin faces a violent repricing Monday if this specific supply-chain metric proves the bond market right,https://cryptoslate.com/bitcoin-faces-a-violent-repricing-monday-if-this-specific-supply-chain-metric-proves-the-bond-market-right/,0.2263,95b848793c8082bee481d079a72f90a1
2026-01-05T06:39:13Z,CryptoSlate,BTC,"Bitcoin price charts lied to you last year, while these eight on-chain signals quietly predicted every single move in 2025",https://cryptoslate.com/the-8-charts-that-explain-crypto-in-2025/,-0.6369,0364f87dac53c7de6b7285458554a323
2026-01-05T06:39:13Z,CryptoSlate,BTC,"Bitcoin is now less volatile than Nvidia, a statistical anomaly that completely changes your risk calculation",https://cryptoslate.com/bitcoin-turned-less-volatile-than-nvidia-as-institutional-rails-absorbed-570-billion-in-swings-during-a-boring-year/,-0.7451,48b644396eed34a8e72a784a74d86d34
2026-01-05T06:39:13Z,CryptoSlate,ALL,"XRP’s $1 billion ETF record is misleading, and one hidden flow metric explains why price remains stagnant",https://cryptoslate.com/xrp-etfs-top-1b-but-why-hasnt-price-moved/,-0.5719,668d66f39e504fab55252222892fdd73
2026-01-05T06:39:13Z,CryptoSlate,BTC,Why doesn’t “good news” move Bitcoin anymore? Macro headwinds repeatedly fall flat,https://cryptoslate.com/why-good-news-hasnt-been-moving-bitcoin-recently-macro-without-the-boom/,-0.594,5ee8e83e9200d3bb29d764fe1495502d
2026-01-05T06:39:13Z,CryptoSlate,BTC,"Tether just bought 8,888 Bitcoin, exposing a mechanical profit engine turning T-Bills into automatic crypto demand",https://cryptoslate.com/tether-just-bought-8888-bitcoin-exposing-a-mechanical-profit-engine-turning-t-bills-into-automatic-crypto-demand/,0.7717,44292db8d67fe332c8961f09da244e79
